10:46:56.264221 00:09:0f:09:00:0d > 33:33:ff:5a:2d:68, ethertype IPv6 (0x86dd), length 86: 2001:df0:92::1 > ff02::1:ff5a:2d68: ICMP6, neighbor solicitation, who has 2001:df0:92:0:1093:dc8d:ec5a:2d68, length 32
10:46:56.283185 d8:24:bd:91:5d:40 > 00:22:4d:6b:9d:84, ethertype IPv4 (0x0800), length 66: 172.26.121.203.40533 > 172.31.5.47.44012: Flags [.], ack 806012811, win 1369, options [nop,nop,TS val 15879170 ecr 25628642], length 0
10:46:56.287000 00:15:5d:01:4f:1b > 33:33:00:01:00:03, ethertype IPv6 (0x86dd), length 84: fe80::c5dd:8a2:c52e:bd18.54555 > ff02::1:3.5355: UDP, length 22
10:46:56.287040 00:15:5d:01:4f:1b > 01:00:5e:00:00:fc, ethertype IPv4 (0x0800), length 64: 172.31.1.153.54796 > 224.0.0.252.5355: UDP, length 22
10:46:56.300315 70:71:bc:af:f9:82 > ff:ff:ff:ff:ff:ff, ethertype ARP (0x0806), length 60: Request who-has 172.31.1.130 tell 172.31.5.161, length 46
10:46:56.302766 70:71:bc:af:f9:82 > ff:ff:ff:ff:ff:ff, ethertype ARP (0x0806), length 60: Request who-has 172.31.1.250 tell 172.31.5.161, length 46
10:46:56.324141 00:09:0f:09:00:0d > 33:33:ff:37:2c:d4, ethertype IPv6 (0x86dd), length 86: 2001:df0:92::1 > ff02::1:ff37:2cd4: ICMP6, neighbor solicitation, who has 2001:df0:92:0:4639:c4ff:fe37:2cd4, length 32
10:46:56.365507 fc:4d:d4:f5:d9:77 > 00:17:a4:3a:9c:04, ethertype IPv4 (0x0800), length 60: 172.31.2.254.57563 > 172.31.1.210.22: Flags [.], ack 568569012, win 253, length 0
10:46:56.369856 d8:24:bd:91:5d:40 > 00:15:17:fd:1c:51, ethertype IPv4 (0x0800), length 91: 216.239.34.10.53 > 172.20.160.23.17038: 49286*- 1/0/0 A 216.58.199.142 (49)
10:46:56.383479 00:15:5d:01:4f:1b > 33:33:00:01:00:03, ethertype IPv6 (0x86dd), length 84: fe80::c5dd:8a2:c52e:bd18.54555 > ff02::1:3.5355: UDP, length 22
10:46:56.383490 00:15:5d:01:4f:1b > 01:00:5e:00:00:fc, ethertype IPv4 (0x0800), length 64: 172.31.1.153.54796 > 224.0.0.252.5355: UDP, length 22
10:46:56.430114 00:09:0f:09:00:0d > 00:30:48:5a:b4:22, ethertype IPv4 (0x0800), length 74: 82.165.156.150.58992 > 172.31.1.105.110: Flags [S], seq 3993668355, win 5840, options [mss 1460,sackOK,TS val 25692906 ecr 0,nop,wscale 1], length 0
10:46:56.430492 00:09:0f:09:00:0d > 00:30:48:5a:b4:22, ethertype IPv4 (0x0800), length 66: 82.165.156.150.58992 > 172.31.1.105.110: Flags [.], ack 1794235042, win 2920, options [nop,nop,TS val 25692906 ecr 655246218], length 0
10:46:56.432256 d8:24:bd:91:5d:40 > fc:4d:d4:f5:dc:cb, ethertype IPv4 (0x0800), length 60: 172.20.96.236.59158 > 172.31.4.186.22: Flags [.], ack 3057524827, win 32768, length 0
10:46:56.432262 d8:24:bd:91:5d:40 > fc:4d:d4:f5:da:75, ethertype IPv4 (0x0800), length 60: 172.20.40.16.51463 > 172.31.4.184.22: Flags [.], ack 3382758314, win 16128, length 0
10:46:56.432497 d8:24:bd:91:5d:40 > e8:39:35:26:87:58, ethertype IPv4 (0x0800), length 107: 172.20.65.204.52398 > 172.31.5.98.3389: Flags [P.], seq 1005586617:1005586670, ack 65402659, win 65174, length 53
10:46:56.432503 d8:24:bd:91:5d:40 > fc:4d:d4:f5:da:28, ethertype IPv4 (0x0800), length 86: 172.20.40.16.59370 > 172.31.4.195.22: Flags [P.], seq 3855940713:3855940745, ack 1337401119, win 15864, length 32
10:46:56.432852 00:19:bb:d0:89:a2 > fc:4d:d4:f5:dc:88, ethertype IPv4 (0x0800), length 206: 172.31.1.157.2049 > 172.31.4.200.752: Flags [P.], seq 1654410067:1654410207, ack 1182358434, win 63712, options [nop,nop,TS val 4196899413 ecr 297354101], length 140: NFS reply xid 579141588 reply ok 136
10:46:56.433740 d8:24:bd:91:5d:40 > 00:22:4d:6b:c0:14, ethertype IPv4 (0x0800), length 2974: 172.31.1.227.3128 > 172.31.5.26.49975: Flags [.], seq 3824941568:3824944488, ack 1884454625, win 63, length 2920
10:46:56.433999 d8:24:bd:91:5d:40 > 00:22:4d:6b:c0:14, ethertype IPv4 (0x0800), length 2974: 172.31.1.227.3128 > 172.31.5.26.49975: Flags [.], seq 0:2920, ack 1, win 63, length 2920
10:46:56.445017 d8:24:bd:91:5d:40 > fc:4d:d4:f5:dc:b5, ethertype IPv4 (0x0800), length 102: 172.26.176.186.54017 > 172.31.4.141.22: Flags [P.], seq 2010030503:2010030551, ack 2261464202, win 64352, length 48
10:46:56.448212 d8:24:bd:91:5d:40 > fc:4d:d4:f5:dd:93, ethertype IPv4 (0x0800), length 102: 172.20.40.16.53467 > 172.31.4.198.22: Flags [P.], seq 1650973646:1650973694, ack 2028908888, win 16036, length 48
10:46:56.448511 d8:24:bd:91:5d:40 > e8:39:35:26:87:58, ethertype IPv4 (0x0800), length 107: 172.20.65.204.52398 > 172.31.5.98.3389: Flags [P.], seq 53:106, ack 1, win 65174, length 53
10:46:56.457793 d8:24:bd:91:5d:40 > 44:39:c4:37:2c:7f, ethertype IPv4 (0x0800), length 66: 96.17.182.114.80 > 172.31.4.202.56775: Flags [F.], seq 3690947884, ack 3355947981, win 5574, options [nop,nop,TS val 25692909 ecr 56460750], length 0
10:46:56.457799 d8:24:bd:91:5d:40 > 44:39:c4:37:2c:7f, ethertype IPv4 (0x0800), length 66: 96.17.182.114.80 > 172.31.4.202.56775: Flags [F.], seq 0, ack 1, win 5574, options [nop,nop,TS val 25692909 ecr 56460750], length 0
10:46:56.462958 d8:24:bd:91:5d:40 > fc:4d:d4:f5:dc:88, ethertype IPv4 (0x0800), length 66: 31.13.79.220.443 > 172.31.4.200.37025: Flags [.], ack 4193949716, win 2039, options [nop,nop,TS val 1305164639 ecr 297354053], length 0
10:46:56.462965 d8:24:bd:91:5d:40 > fc:4d:d4:f5:dc:88, ethertype IPv4 (0x0800), length 108: 31.13.79.220.443 > 172.31.4.200.37025: Flags [P.], seq 0:42, ack 1, win 2039, options [nop,nop,TS val 1305164639 ecr 297354053], length 42
10:46:56.462967 d8:24:bd:91:5d:40 > fc:4d:d4:f5:dc:88, ethertype IPv4 (0x0800), length 66: 31.13.79.220.443 > 172.31.4.200.37025: Flags [.], ack 1, win 2039, options [nop,nop,TS val 1305164639 ecr 297354053], length 0
10:46:56.463225 d8:24:bd:91:5d:40 > fc:4d:d4:f5:dc:88, ethertype IPv4 (0x0800), length 108: 31.13.79.220.443 > 172.31.4.200.37025: Flags [P.], seq 0:42, ack 1, win 2039, options [nop,nop,TS val 1305164639 ecr 297354053], length 42
10:46:56.463231 d8:24:bd:91:5d:40 > 44:39:c4:37:2c:c4, ethertype IPv4 (0x0800), length 66: 216.58.220.33.443 > 172.31.4.135.58190: Flags [.], ack 2882721826, win 845, options [nop,nop,TS val 2008850373 ecr 69030003], length 0
10:46:56.463233 d8:24:bd:91:5d:40 > 44:39:c4:37:2c:c4, ethertype IPv4 (0x0800), length 66: 216.58.220.33.443 > 172.31.4.135.58190: Flags [.], ack 1, win 845, options [nop,nop,TS val 2008850373 ecr 69030003], length 0
10:46:56.464264 d8:24:bd:91:5d:40 > 44:39:c4:37:2d:01, ethertype IPv4 (0x0800), length 102: 172.20.40.16.50072 > 172.31.4.196.22: Flags [P.], seq 2655181583:2655181631, ack 210516635, win 15904, length 48
10:46:56.464960 d8:24:bd:91:5d:40 > 44:39:c4:37:2c:c4, ethertype IPv4 (0x0800), length 206: 216.58.220.33.443 > 172.31.4.135.58190: Flags [P.], seq 0:140, ack 1, win 845, options [nop,nop,TS val 2008850374 ecr 69030003], length 140
10:46:56.469527 d8:24:bd:91:5d:40 > 74:27:ea:0b:7d:09, ethertype IPv4 (0x0800), length 143: 5.245.173.25.16001 > 172.31.4.140.33520: UDP, length 101
10:46:56.469534 d8:24:bd:91:5d:40 > 74:27:ea:0b:7d:09, ethertype IPv4 (0x0800), length 143: 5.245.173.25.16001 > 172.31.4.140.33520: UDP, length 101
10:46:56.489537 d8:24:bd:91:5d:40 > fc:4d:d4:f5:dc:8c, ethertype IPv4 (0x0800), length 118: 172.26.178.50.49400 > 172.31.4.153.22: Flags [P.], seq 345351672:345351736, ack 2640037778, win 16165, length 64
10:46:56.490473 d8:24:bd:91:5d:40 > fc:4d:d4:f5:dc:8c, ethertype IPv4 (0x0800), length 118: 172.26.178.50.49400 > 172.31.4.153.22: Flags [P.], seq 64:128, ack 65, win 16149, length 64
10:46:56.538286 d8:24:bd:91:5d:40 > fc:4d:d4:f5:db:0c, ethertype IPv4 (0x0800), length 66: 172.26.174.27.49504 > 172.31.4.162.22: Flags [.], ack 2897601376, win 22460, options [nop,nop,TS val 15962983 ecr 297359166], length 0
10:46:56.539817 e4:90:7e:9b:84:ca > ff:ff:ff:ff:ff:ff, 802.3, length 60: LLC, dsap Null (0x00) Individual, ssap Null (0x00) Command, ctrl 0x81f5: Supervisory, Receiver not Ready, rcv seq 64, Flags [Poll], length 46
10:46:56.555470 00:1e:8c:c7:41:49 > ff:ff:ff:ff:ff:ff, ethertype IPv4 (0x0800), length 92: 172.31.9.83.137 > 172.31.255.255.137: NBT UDP PACKET(137): QUERY; REQUEST; BROADCAST
10:46:56.559040 d8:24:bd:91:5d:40 > 70:71:bc:af:fa:68, ethertype IPv4 (0x0800), length 60: 204.246.164.113.443 > 172.31.3.221.60199: Flags [.], ack 3165324189, win 16616, length 0
10:46:56.559928 d8:24:bd:91:5d:40 > 70:71:bc:af:fa:6b, ethertype IPv4 (0x0800), length 66: 74.125.68.188.443 > 172.31.5.166.49559: Flags [.], ack 3060096710, win 363, options [nop,nop,sack 1 {0:1}], length 0
10:46:56.559941 d8:24:bd:91:5d:40 > 70:71:bc:af:fa:6b, ethertype IPv4 (0x0800), length 66: 74.125.68.188.443 > 172.31.5.166.49559: Flags [.], ack 1, win 363, options [nop,nop,sack 1 {0:1}], length 0
10:46:56.587355 00:15:5d:01:4f:1b > ff:ff:ff:ff:ff:ff, ethertype IPv4 (0x0800), length 92: 172.31.1.153.137 > 172.31.255.255.137: NBT UDP PACKET(137): QUERY; REQUEST; BROADCAST
10:46:56.587579 d8:24:bd:91:5d:40 > fc:4d:d4:f5:dc:88, ethertype IPv4 (0x0800), length 66: 31.13.79.220.443 > 172.31.4.200.37025: Flags [.], ack 61, win 2043, options [nop,nop,TS val 1305164758 ecr 297354132], length 0
10:46:56.596547 fc:4d:d4:f5:d9:77 > 00:15:17:ea:f4:0c, ethertype IPv4 (0x0800), length 60: 172.31.2.254.57527 > 172.31.1.233.22: Flags [.], ack 712738207, win 256, length 0
10:46:56.626202 d8:24:bd:91:5d:40 > fc:4d:d4:f5:dc:b4, ethertype IPv4 (0x0800), length 60: 172.20.41.202.50981 > 172.31.4.206.22: Flags [.], ack 855733482, win 15816, length 0
10:46:56.636778 d8:24:bd:91:5d:40 > 4c:00:82:71:7e:e4, ethertype IPv4 (0x0800), length 118: 172.31.1.250 > 172.31.1.34: ICMP echo reply, id 0, seq 0, length 84
10:46:56.640635 00:09:0f:09:00:0d > 44:87:fc:7f:95:df, ethertype IPv4 (0x0800), length 66: 121.244.189.230.53987 > 172.31.1.76.80: Flags [.], ack 1095893370, win 24616, options [nop,nop,TS val 25692927 ecr 23534164], length 0
10:46:56.667518 d8:24:bd:91:5d:40 > fc:4d:d4:f5:da:dc, ethertype IPv4 (0x0800), length 66: 216.58.220.46.443 > 172.31.4.151.35380: Flags [.], ack 555594596, win 438, options [nop,nop,TS val 2012666127 ecr 71319131], length 0
10:46:56.667530 d8:24:bd:91:5d:40 > fc:4d:d4:f5:da:dc, ethertype IPv4 (0x0800), length 66: 216.58.220.46.443 > 172.31.4.151.35380: Flags [.], ack 1, win 438, options [nop,nop,TS val 2012666127 ecr 71319131], length 0
10:46:56.682290 d8:24:bd:91:5d:40 > 74:27:ea:0b:7d:09, ethertype IPv4 (0x0800), length 693: 124.153.80.84.25002 > 172.31.4.140.63133: Flags [P.], seq 1435187329:1435187968, ack 874489364, win 257, length 639
10:46:56.756696 00:1e:8c:c7:41:34 > ff:ff:ff:ff:ff:ff, ethertype IPv4 (0x0800), length 92: 172.31.2.22.137 > 172.31.255.255.137: NBT UDP PACKET(137): QUERY; REQUEST; BROADCAST
10:46:56.817970 d8:24:bd:91:5d:40 > fc:4d:d4:f5:dc:b4, ethertype IPv4 (0x0800), length 60: 172.20.41.202.50981 > 172.31.4.206.22: Flags [.], ack 97, win 15792, length 0
10:46:56.824964 d8:24:bd:91:5d:40 > 60:36:dd:42:8d:2b, ethertype IPv4 (0x0800), length 60: 216.58.220.37.443 > 172.31.15.147.49714: Flags [.], ack 3710035544, win 1653, length 0
10:46:56.824975 d8:24:bd:91:5d:40 > 60:36:dd:42:8d:2b, ethertype IPv4 (0x0800), length 60: 216.58.220.37.443 > 172.31.15.147.49714: Flags [.], ack 115, win 1653, length 0
10:46:56.826884 18:a9:05:46:7b:e8 > ff:ff:ff:ff:ff:ff, ethertype ARP (0x0806), length 60: Request who-has 172.31.1.218 tell 172.31.1.138, length 46
10:46:56.849655 00:1e:8c:c7:41:28 > ff:ff:ff:ff:ff:ff, ethertype IPv4 (0x0800), length 92: 172.31.11.91.137 > 172.31.255.255.137: NBT UDP PACKET(137): QUERY; REQUEST; BROADCAST
10:46:56.850014 00:1e:8c:c7:41:28 > 01:00:5e:00:00:fc, ethertype IPv4 (0x0800), length 69: 172.31.11.91.52230 > 224.0.0.252.5355: UDP, length 27
10:46:56.850291 00:1e:8c:c7:41:28 > 01:00:5e:00:00:fc, ethertype IPv4 (0x0800), length 69: 172.31.11.91.51893 > 224.0.0.252.5355: UDP, length 27
10:46:56.854148 e4:90:7e:9b:84:ca > ff:ff:ff:ff:ff:ff, ethertype ARP (0x0806), length 60: Request who-has 172.20.99.254 tell 172.20.97.2, length 46
10:46:56.867416 00:07:e9:31:86:49 > ff:ff:ff:ff:ff:ff, ethertype IPv4 (0x0800), length 243: 172.31.13.200.138 > 172.31.255.255.138: NBT UDP PACKET(138)
10:46:56.886956 00:90:a9:35:2c:72 > ff:ff:ff:ff:ff:ff, ethertype ARP (0x0806), length 60: Request who-has 172.31.9.57 tell 172.31.76.248, length 46
10:46:56.909933 70:71:bc:af:fa:ab > ff:ff:ff:ff:ff:ff, ethertype ARP (0x0806), length 60: Request who-has 172.31.5.200 tell 172.31.5.190, length 46
10:46:56.932992 74:27:ea:0a:ef:47 > ff:ff:ff:ff:ff:ff, ethertype IPv4 (0x0800), length 92: 172.31.9.69.137 > 172.31.255.255.137: NBT UDP PACKET(137): QUERY; REQUEST; BROADCAST
10:46:56.933129 74:27:ea:0a:ef:47 > 33:33:00:01:00:03, ethertype IPv6 (0x86dd), length 84: fe80::554f:dc1d:5eed:c5d4.61637 > ff02::1:3.5355: UDP, length 22
10:46:56.933439 74:27:ea:0a:ef:47 > 01:00:5e:00:00:fc, ethertype IPv4 (0x0800), length 64: 172.31.9.69.61637 > 224.0.0.252.5355: UDP, length 22
10:46:56.933607 74:27:ea:0a:ef:47 > 33:33:00:01:00:03, ethertype IPv6 (0x86dd), length 84: fe80::554f:dc1d:5eed:c5d4.52253 > ff02::1:3.5355: UDP, length 22
10:46:56.933623 74:27:ea:0a:ef:47 > 01:00:5e:00:00:fc, ethertype IPv4 (0x0800), length 64: 172.31.9.69.52253 > 224.0.0.252.5355: UDP, length 22
10:46:57.021867 e8:ed:f3:96:e6:8d > 01:80:c2:00:00:00, 802.3, length 60: LLC, dsap STP (0x42) Individual, ssap STP (0x42) Command, ctrl 0x03: STP 802.1d, Config, Flags [Topology change], bridge-id 8001.e8:ed:f3:96:e6:80.800d, length 43
10:46:57.065382 08:00:20:c4:a5:37 > ff:ff:ff:ff:ff:ff, ethertype ARP (0x0806), length 60: Request who-has 172.31.1.27 (ff:ff:ff:ff:ff:ff) tell 172.31.1.29, length 46
10:46:57.074241 00:09:0f:09:00:0d > 33:33:ff:98:3c:59, ethertype IPv6 (0x86dd), length 86: 2001:df0:92::1 > ff02::1:ff98:3c59: ICMP6, neighbor solicitation, who has 2001:df0:92:0:ddb8:3b3f:6f98:3c59, length 32
10:46:57.077694 d8:24:bd:91:5d:40 > ff:ff:ff:ff:ff:ff, ethertype ARP (0x0806), length 60: Request who-has 172.20.160.101 tell 172.20.167.254, length 46
10:46:57.120724 70:71:bc:af:fa:c5 > ff:ff:ff:ff:ff:ff, ethertype ARP (0x0806), length 60: Request who-has 172.31.5.200 tell 172.31.5.160, length 46
10:46:57.185092 00:0c:29:e3:4b:f8 > ff:ff:ff:ff:ff:ff, ethertype IPv4 (0x0800), length 92: 172.31.8.12.137 > 172.31.255.255.137: NBT UDP PACKET(137): QUERY; REQUEST; BROADCAST
10:46:57.262474 00:1e:8c:c7:41:28 > 01:00:5e:00:00:fc, ethertype IPv4 (0x0800), length 69: 172.31.11.91.51893 > 224.0.0.252.5355: UDP, length 27
10:46:57.310361 70:71:bc:af:fb:03 > ff:ff:ff:ff:ff:ff, ethertype ARP (0x0806), length 60: Request who-has 172.31.5.200 tell 172.31.5.163, length 46
10:46:57.318035 00:15:17:98:d0:9e > ff:ff:ff:ff:ff:ff, ethertype ARP (0x0806), length 60: Request who-has 15.15.151.15 (ff:ff:ff:ff:ff:ff) tell 15.15.151.15, length 46
10:46:57.335223 00:15:5d:01:4f:1b > ff:ff:ff:ff:ff:ff, ethertype IPv4 (0x0800), length 92: 172.31.1.153.137 > 172.31.255.255.137: NBT UDP PACKET(137): QUERY; REQUEST; BROADCAST
10:46:57.343297 74:27:ea:0a:ef:47 > 33:33:00:01:00:03, ethertype IPv6 (0x86dd), length 84: fe80::554f:dc1d:5eed:c5d4.61637 > ff02::1:3.5355: UDP, length 22
10:46:57.343316 74:27:ea:0a:ef:47 > 33:33:00:01:00:03, ethertype IPv6 (0x86dd), length 84: fe80::554f:dc1d:5eed:c5d4.52253 > ff02::1:3.5355: UDP, length 22
10:46:57.343320 74:27:ea:0a:ef:47 > 01:00:5e:00:00:fc, ethertype IPv4 (0x0800), length 64: 172.31.9.69.52253 > 224.0.0.252.5355: UDP, length 22
10:46:57.343559 74:27:ea:0a:ef:47 > 01:00:5e:00:00:fc, ethertype IPv4 (0x0800), length 64: 172.31.9.69.61637 > 224.0.0.252.5355: UDP, length 22
10:46:57.351861 d8:24:bd:91:5d:40 > ff:ff:ff:ff:ff:ff, ethertype ARP (0x0806), length 60: Request who-has 172.31.1.175 tell 172.31.1.250, length 46
10:46:57.360411 fc:4d:d4:f5:d9:77 > 00:17:a4:3a:9c:04, ethertype IPv4 (0x0800), length 60: 172.31.2.254.57563 > 172.31.1.210.22: Flags [.], ack 133, win 252, length 0
10:46:57.386587 00:1e:8c:c7:41:49 > ff:ff:ff:ff:ff:ff, ethertype IPv4 (0x0800), length 92: 172.31.9.83.137 > 172.31.255.255.137: NBT UDP PACKET(137): QUERY; REQUEST; BROADCAST
10:46:57.398600 00:19:99:7a:09:da > 00:19:99:7a:09:d3, ethertype IPv4 (0x0800), length 193: 172.31.210.163.51020 > 172.31.210.162.1715: Flags [P.], seq 1568059859:1568059986, ack 2571664394, win 71, options [nop,nop,TS val 256300148 ecr 256276498], length 127
10:46:57.447002 00:30:48:7b:a7:5a > 44:39:c4:37:2c:a2, ethertype ARP (0x0806), length 60: Request who-has 172.31.4.136 tell 172.31.1.130, length 46
10:46:57.506739 00:1e:8c:c7:41:34 > ff:ff:ff:ff:ff:ff, ethertype IPv4 (0x0800), length 92: 172.31.2.22.137 > 172.31.255.255.137: NBT UDP PACKET(137): QUERY; REQUEST; BROADCAST
10:46:57.597637 fc:4d:d4:f5:d9:77 > 00:15:17:ea:f4:0c, ethertype IPv4 (0x0800), length 60: 172.31.2.254.57527 > 172.31.1.233.22: Flags [.], ack 133, win 256, length 0
10:46:57.676879 d8:24:bd:91:5d:40 > 4c:00:82:71:7e:e4, ethertype IPv4 (0x0800), length 118: 172.31.1.250 > 172.31.1.34: ICMP echo reply, id 0, seq 0, length 84
10:46:57.682529 74:27:ea:0a:ef:47 > ff:ff:ff:ff:ff:ff, ethertype IPv4 (0x0800), length 92: 172.31.9.69.137 > 172.31.255.255.137: NBT UDP PACKET(137): QUERY; REQUEST; BROADCAST
10:46:57.685470 18:3d:a2:96:af:b4 > ff:ff:ff:ff:ff:ff, ethertype IPv4 (0x0800), length 342: 172.31.12.233.68 > 255.255.255.255.67: BOOTP/DHCP, Request from 18:3d:a2:96:af:b4, length 300
10:46:57.688019 00:1e:8c:c7:41:28 > 01:00:5e:00:00:fc, ethertype IPv4 (0x0800), length 69: 172.31.11.91.53644 > 224.0.0.252.5355: UDP, length 27
10:46:57.688118 00:1e:8c:c7:41:28 > 01:00:5e:00:00:fc, ethertype IPv4 (0x0800), length 69: 172.31.11.91.57852 > 224.0.0.252.5355: UDP, length 27
10:46:57.705695 70:71:bc:af:fa:ab > ff:ff:ff:ff:ff:ff, ethertype ARP (0x0806), length 60: Request who-has 172.31.5.200 tell 172.31.5.190, length 46
10:46:57.715887 70:71:bc:af:fb:03 > ff:ff:ff:ff:ff:ff, ethertype ARP (0x0806), length 60: Request who-has 172.31.5.200 tell 172.31.5.163, length 46
10:46:57.785753 00:22:4d:6b:9e:5f > ff:ff:ff:ff:ff:ff, ethertype ARP (0x0806), length 60: Request who-has 172.31.13.200 tell 172.31.5.25, length 46
10:46:57.838235 70:71:bc:af:fa:c5 > ff:ff:ff:ff:ff:ff, ethertype ARP (0x0806), length 60: Request who-has 172.31.5.200 tell 172.31.5.160, length 46
10:46:57.875498 e4:90:7e:9b:84:ca > ff:ff:ff:ff:ff:ff, ethertype ARP (0x0806), length 60: Request who-has 172.20.99.254 tell 172.20.97.2, length 46
