12:38:42.564915 d8:24:bd:91:5d:40 > 70:71:bc:af:fa:68, ethertype IPv4 (0x0800), length 85: 122.252.139.108.443 > 172.31.3.221.51105: Flags [P.], seq 673759763:673759794, ack 156736674, win 32160, length 31
12:38:42.564921 d8:24:bd:91:5d:40 > 70:71:bc:af:fa:68, ethertype IPv4 (0x0800), length 60: 122.252.139.108.443 > 172.31.3.221.51105: Flags [F.], seq 31, ack 1, win 32160, length 0
12:38:42.564922 d8:24:bd:91:5d:40 > 70:71:bc:af:fa:68, ethertype IPv4 (0x0800), length 85: 122.252.139.108.443 > 172.31.3.221.51105: Flags [P.], seq 0:31, ack 1, win 32160, length 31
12:38:42.564923 d8:24:bd:91:5d:40 > 70:71:bc:af:fa:68, ethertype IPv4 (0x0800), length 60: 122.252.139.108.443 > 172.31.3.221.51105: Flags [F.], seq 31, ack 1, win 32160, length 0
12:38:42.583866 d8:24:bd:91:5d:40 > 70:71:bc:af:fa:68, ethertype IPv4 (0x0800), length 85: 122.252.139.108.443 > 172.31.3.221.51104: Flags [P.], seq 676593439:676593470, ack 722134096, win 32160, length 31
12:38:42.625054 70:71:bc:af:fa:0c > ff:ff:ff:ff:ff:ff, ethertype ARP (0x0806), length 60: Request who-has 172.31.5.200 tell 172.31.5.159, length 46
12:38:42.632420 00:23:e9:f1:84:c3 > 00:23:e9:f1:ea:03, ethertype IPv4 (0x0800), length 229: 172.31.1.95.55493 > 172.31.1.94.1026: UDP, length 187
12:38:42.691581 d8:24:bd:91:5d:40 > e8:39:35:26:86:a4, ethertype IPv4 (0x0800), length 560: 182.68.195.226.57485 > 172.20.160.102.80: Flags [P.], seq 3903224027:3903224533, ack 1147753990, win 16524, length 506
12:38:42.691587 d8:24:bd:91:5d:40 > e8:39:35:26:86:a4, ethertype IPv4 (0x0800), length 60: 182.68.195.226.57486 > 172.20.160.102.80: Flags [.], ack 4002462498, win 16660, length 0
12:38:42.803306 34:40:b5:1a:a3:00 > ff:ff:ff:ff:ff:ff, ethertype ARP (0x0806), length 60: Request who-has 192.168.137.1 tell 192.168.137.36, length 46
12:38:42.827113 d8:24:bd:91:5d:40 > 4c:00:82:71:7e:e4, ethertype IPv4 (0x0800), length 118: 172.31.1.250 > 172.31.1.34: ICMP echo reply, id 0, seq 0, length 84
12:38:42.828735 d8:24:bd:91:5d:40 > 00:15:17:fd:1c:51, ethertype IPv4 (0x0800), length 131: 208.72.192.166.53 > 172.20.160.23.50639: 24826*- 1/0/1 CNAME bench.utp.st. (89)
12:38:42.863660 d8:24:bd:91:5d:40 > 44:39:c4:37:2c:fd, ethertype IPv4 (0x0800), length 60: 172.28.6.201.49963 > 172.31.4.128.22: Flags [.], ack 2168804823, win 16217, length 0
12:38:42.864554 d8:24:bd:91:5d:40 > fc:4d:d4:f5:dd:4b, ethertype IPv4 (0x0800), length 118: 172.20.237.83.2732 > 172.31.4.185.22: Flags [P.], seq 181399159:181399223, ack 3026357918, win 251, length 64
12:38:42.865219 00:19:bb:d0:89:90 > fc:4d:d4:f5:dd:07, ethertype IPv4 (0x0800), length 206: 172.31.1.156.2049 > 172.31.4.111.937: Flags [P.], seq 2140846829:2140846969, ack 3030059401, win 63712, options [nop,nop,TS val 417207859 ecr 156976565], length 140: NFS reply xid 2048841191 reply ok 136
12:38:42.865729 d8:24:bd:91:5d:40 > 52:54:00:06:f8:07, ethertype IPv4 (0x0800), length 819: 172.31.1.16.143 > 172.20.160.34.42880: Flags [P.], seq 957729472:957730225, ack 1727301536, win 46, options [nop,nop,TS val 638535348 ecr 1103482903], length 753
12:38:42.866016 d8:24:bd:91:5d:40 > 52:54:00:06:f8:07, ethertype IPv4 (0x0800), length 819: 172.31.1.16.143 > 172.20.160.34.42880: Flags [P.], seq 0:753, ack 1, win 46, options [nop,nop,TS val 638535348 ecr 1103482903], length 753
12:38:42.866019 d8:24:bd:91:5d:40 > 08:00:20:c4:a5:37, ethertype IPv4 (0x0800), length 92: 172.28.48.27.65434 > 172.31.1.29.1521: Flags [P.], seq 3005026836:3005026874, ack 4158948207, win 251, length 38
12:38:42.867898 d8:24:bd:91:5d:40 > 44:39:c4:37:2c:e4, ethertype IPv4 (0x0800), length 60: 172.28.6.201.51201 > 172.31.4.127.22: Flags [.], ack 1439950045, win 16189, length 0
12:38:42.868937 00:19:bb:d2:f4:ba > fc:4d:d4:f5:dc:db, ethertype IPv4 (0x0800), length 206: 172.31.1.158.2049 > 172.31.4.119.915: Flags [P.], seq 1961079198:1961079338, ack 2593605067, win 63712, options [nop,nop,TS val 324130018 ecr 169979293], length 140: NFS reply xid 3222467588 reply ok 136
12:38:42.870977 d8:24:bd:91:5d:40 > 52:54:00:06:f8:07, ethertype IPv4 (0x0800), length 143: 172.31.1.16.143 > 172.20.160.34.42878: Flags [P.], seq 948554255:948554332, ack 2597338942, win 46, options [nop,nop,TS val 638535353 ecr 1103482895], length 77
12:38:42.883908 d8:24:bd:91:5d:40 > 00:15:17:fd:1c:51, ethertype IPv4 (0x0800), length 82: 172.25.30.52.50953 > 172.20.160.23.53: 53429+ A? edge-mqtt.facebook.com. (40)
12:38:42.893937 00:09:0f:09:00:0d > fc:4d:d4:f5:da:26, ethertype IPv6 (0x86dd), length 98: 2404:6800:4003:c00::5e.443 > 2001:df0:92:0:fe4d:d4ff:fef5:da26.55119: Flags [.], ack 4288466279, win 679, options [nop,nop,TS val 562862696 ecr 229149044,nop,nop,sack 1 {93:314}], length 0
12:38:42.895052 d8:24:bd:91:5d:40 > fc:4d:d4:f5:da:8a, ethertype IPv4 (0x0800), length 60: 172.28.6.201.56522 > 172.31.4.103.22: Flags [.], ack 348700831, win 16307, length 0
12:38:42.896887 d8:24:bd:91:5d:40 > 30:8d:99:bd:50:d5, ethertype IPv4 (0x0800), length 528: 15.203.153.225.443 > 172.31.15.207.49499: Flags [P.], seq 3623748433:3623748907, ack 2900076694, win 254, length 474
12:38:42.896892 d8:24:bd:91:5d:40 > 30:8d:99:bd:50:d5, ethertype IPv4 (0x0800), length 528: 15.203.153.225.443 > 172.31.15.207.49499: Flags [P.], seq 0:474, ack 1, win 254, length 474
12:38:42.925137 00:23:e9:f5:07:c3 > 2c:44:fd:90:06:50, ethertype IPv4 (0x0800), length 60: 172.31.7.122 > 172.31.7.65: ICMP echo request, id 5102, seq 0, length 20
12:38:42.925143 00:23:e9:f5:07:c3 > 2c:44:fd:90:06:50, ethertype ARP (0x0806), length 60: Request who-has 172.31.7.65 (2c:44:fd:90:06:50) tell 172.31.7.122, length 46
12:38:42.927897 d8:24:bd:91:5d:40 > 6c:ae:8b:1f:df:0a, ethertype IPv4 (0x0800), length 66: 172.20.60.88.64205 > 172.31.1.28.80: Flags [S], seq 469059987, win 8192, options [mss 1460,nop,wscale 2,nop,nop,sackOK], length 0
12:38:42.930360 00:15:17:98:cd:f6 > ff:ff:ff:ff:ff:ff, ethertype ARP (0x0806), length 60: Request who-has 151.8.98.98 (ff:ff:ff:ff:ff:ff) tell 151.8.98.98, length 46
12:38:42.931288 d8:24:bd:91:5d:40 > 74:27:ea:0b:7d:09, ethertype IPv4 (0x0800), length 590: 180.179.182.130.25002 > 172.31.4.140.55520: Flags [.], seq 3290360257:3290360793, ack 1129052325, win 512, length 536
12:38:42.931293 d8:24:bd:91:5d:40 > 74:27:ea:0b:7d:09, ethertype IPv4 (0x0800), length 590: 180.179.182.130.25002 > 172.31.4.140.55520: Flags [.], seq 0:536, ack 1, win 512, length 536
12:38:42.931616 d8:24:bd:91:5d:40 > 74:27:ea:0b:7d:09, ethertype IPv4 (0x0800), length 667: 180.179.182.130.25002 > 172.31.4.140.55520: Flags [P.], seq 536:1149, ack 1, win 512, length 613
12:38:42.931620 d8:24:bd:91:5d:40 > 74:27:ea:0b:7d:09, ethertype IPv4 (0x0800), length 667: 180.179.182.130.25002 > 172.31.4.140.55520: Flags [P.], seq 536:1149, ack 1, win 512, length 613
12:38:42.931621 e8:39:35:29:90:e2 > 44:39:c4:37:2c:c8, ethertype IPv4 (0x0800), length 66: 172.31.1.1.389 > 172.31.4.197.36914: Flags [F.], seq 589088693, ack 3610268072, win 185, options [nop,nop,TS val 2561587369 ecr 57448099], length 0
12:38:42.931622 e8:39:35:29:90:e2 > fc:4d:d4:f5:d9:7a, ethertype IPv4 (0x0800), length 66: 172.31.1.1.389 > 172.31.4.117.54363: Flags [F.], seq 4232469771, ack 880630908, win 122, options [nop,nop,TS val 2561587369 ecr 154895458], length 0
12:38:42.931623 e8:39:35:29:90:e2 > 44:39:c4:37:2c:e5, ethertype IPv4 (0x0800), length 66: 172.31.1.1.389 > 172.31.4.171.39500: Flags [F.], seq 1522854545, ack 1557850657, win 122, options [nop,nop,TS val 2561587369 ecr 228953261], length 0
12:38:42.946977 68:48:98:e8:ad:a7 > 33:33:00:00:00:16, ethertype IPv6 (0x86dd), length 90: :: > ff02::16: HBH ICMP6, multicast listener report v2, 1 group record(s), length 28
12:38:42.989215 d8:24:bd:91:5d:40 > fc:4d:d4:f5:dc:ff, ethertype IPv4 (0x0800), length 60: 172.28.6.201.56457 > 172.31.4.113.22: Flags [.], ack 994141628, win 16425, length 0
12:38:42.993904 d8:24:bd:91:5d:40 > 40:f2:e9:2c:ed:6b, ethertype IPv4 (0x0800), length 118: 172.20.174.1.36900 > 172.31.100.79.22: Flags [P.], seq 756590183:756590235, ack 4225553956, win 2252, options [nop,nop,TS val 86220542 ecr 4233316499], length 52
12:38:43.001391 d8:24:bd:91:5d:40 > 30:8d:99:bd:50:d5, ethertype IPv4 (0x0800), length 60: 216.58.220.46.443 > 172.31.15.207.50485: Flags [.], ack 3715504902, win 363, length 0
12:38:43.020639 00:09:0f:09:00:0d > 98:be:94:3d:bc:6a, ethertype IPv4 (0x0800), length 74: 221.229.172.97.20612 > 172.31.1.10.22: Flags [S], seq 321668113, win 29200, options [mss 1460,sackOK,TS val 3980652 ecr 0,nop,wscale 7], length 0
12:38:43.020646 00:09:0f:09:00:0d > 98:be:94:3d:bc:6a, ethertype IPv4 (0x0800), length 66: 221.229.172.97.54674 > 172.31.1.10.22: Flags [F.], seq 2632631487, ack 2029314149, win 255, options [nop,nop,TS val 3980652 ecr 4233220999], length 0
12:38:43.023034 d8:24:bd:91:5d:40 > 2c:44:fd:8f:33:10, ethertype IPv4 (0x0800), length 102: 172.20.40.31.59179 > 172.31.7.67.22: Flags [P.], seq 3474153734:3474153782, ack 2172120806, win 1452, length 48
12:38:43.031600 d8:24:bd:91:5d:40 > fc:4d:d4:f5:db:e5, ethertype IPv4 (0x0800), length 60: 172.20.41.26.7349 > 172.31.4.173.22: Flags [.], ack 4259256542, win 15776, length 0
12:38:43.036304 d8:24:bd:91:5d:40 > 40:f2:e9:9b:44:b4, ethertype IPv4 (0x0800), length 150: 116.31.116.8.31835 > 172.20.160.24.22: Flags [P.], seq 2237928459:2237928543, ack 4041372292, win 250, options [nop,nop,TS val 3975450 ecr 1167187208], length 84
12:38:43.039819 00:09:0f:09:00:0d > 00:30:48:5a:b4:22, ethertype ARP (0x0806), length 60: Request who-has 172.31.1.105 tell 172.31.1.251, length 46
12:38:43.051962 74:27:ea:0a:ef:47 > 33:33:00:00:00:16, ethertype IPv6 (0x86dd), length 90: fe80::554f:dc1d:5eed:c5d4 > ff02::16: HBH ICMP6, multicast listener report v2, 1 group record(s), length 28
12:38:43.054421 74:27:ea:0a:ef:47 > 33:33:00:00:00:16, ethertype IPv6 (0x86dd), length 90: fe80::554f:dc1d:5eed:c5d4 > ff02::16: HBH ICMP6, multicast listener report v2, 1 group record(s), length 28
12:38:43.060194 74:27:ea:0a:ef:47 > 33:33:00:00:00:0c, ethertype IPv6 (0x86dd), length 1246: fe80::554f:dc1d:5eed:c5d4.57743 > ff02::c.3702: UDP, length 1184
12:38:43.069228 74:27:ea:0a:ef:47 > 33:33:00:00:00:0c, ethertype IPv6 (0x86dd), length 1246: fe80::554f:dc1d:5eed:c5d4.57743 > ff02::c.3702: UDP, length 1184
12:38:43.069248 74:27:ea:0a:ef:47 > 33:33:00:00:00:16, ethertype IPv6 (0x86dd), length 90: fe80::554f:dc1d:5eed:c5d4 > ff02::16: HBH ICMP6, multicast listener report v2, 1 group record(s), length 28
12:38:43.069665 74:27:ea:0a:ef:47 > 33:33:00:00:00:16, ethertype IPv6 (0x86dd), length 90: fe80::554f:dc1d:5eed:c5d4 > ff02::16: HBH ICMP6, multicast listener report v2, 1 group record(s), length 28
12:38:43.070741 74:27:ea:0a:ef:47 > 33:33:00:01:00:03, ethertype IPv6 (0x86dd), length 87: fe80::554f:dc1d:5eed:c5d4.59840 > ff02::1:3.5355: UDP, length 25
12:38:43.070822 74:27:ea:0a:ef:47 > 01:00:5e:00:00:fc, ethertype IPv4 (0x0800), length 67: 172.31.9.69.59840 > 224.0.0.252.5355: UDP, length 25
12:38:43.082036 d8:24:bd:91:5d:40 > ff:ff:ff:ff:ff:ff, ethertype ARP (0x0806), length 60: Request who-has 172.31.1.30 tell 172.31.1.250, length 46
12:38:43.127504 74:27:ea:0a:ef:47 > 33:33:00:00:00:16, ethertype IPv6 (0x86dd), length 110: fe80::554f:dc1d:5eed:c5d4 > ff02::16: HBH ICMP6, multicast listener report v2, 2 group record(s), length 48
12:38:43.128133 74:27:ea:0a:ef:47 > 33:33:00:00:00:16, ethertype IPv6 (0x86dd), length 90: fe80::554f:dc1d:5eed:c5d4 > ff02::16: HBH ICMP6, multicast listener report v2, 1 group record(s), length 28
12:38:43.138432 74:27:ea:0a:ef:47 > ff:ff:ff:ff:ff:ff, ethertype IPv4 (0x0800), length 92: 172.31.9.69.137 > 172.31.255.255.137: NBT UDP PACKET(137): QUERY; REQUEST; BROADCAST
12:38:43.138449 74:27:ea:0a:ef:47 > 33:33:00:01:00:03, ethertype IPv6 (0x86dd), length 84: fe80::554f:dc1d:5eed:c5d4.55619 > ff02::1:3.5355: UDP, length 22
12:38:43.138537 74:27:ea:0a:ef:47 > ff:ff:ff:ff:ff:ff, ethertype IPv4 (0x0800), length 92: 172.31.9.69.137 > 172.31.255.255.137: NBT UDP PACKET(137): QUERY; REQUEST; BROADCAST
12:38:43.138539 74:27:ea:0a:ef:47 > 01:00:5e:00:00:fc, ethertype IPv4 (0x0800), length 64: 172.31.9.69.55619 > 224.0.0.252.5355: UDP, length 22
12:38:43.138829 74:27:ea:0a:ef:47 > 33:33:00:01:00:03, ethertype IPv6 (0x86dd), length 84: fe80::554f:dc1d:5eed:c5d4.49303 > ff02::1:3.5355: UDP, length 22
12:38:43.138835 74:27:ea:0a:ef:47 > 33:33:00:01:00:03, ethertype IPv6 (0x86dd), length 84: fe80::554f:dc1d:5eed:c5d4.62914 > ff02::1:3.5355: UDP, length 22
12:38:43.138837 74:27:ea:0a:ef:47 > 01:00:5e:00:00:fc, ethertype IPv4 (0x0800), length 64: 172.31.9.69.49303 > 224.0.0.252.5355: UDP, length 22
12:38:43.138839 74:27:ea:0a:ef:47 > 01:00:5e:00:00:fc, ethertype IPv4 (0x0800), length 64: 172.31.9.69.62914 > 224.0.0.252.5355: UDP, length 22
12:38:43.139004 74:27:ea:0a:ef:47 > 33:33:00:01:00:03, ethertype IPv6 (0x86dd), length 84: fe80::554f:dc1d:5eed:c5d4.52477 > ff02::1:3.5355: UDP, length 22
12:38:43.139011 74:27:ea:0a:ef:47 > 01:00:5e:00:00:fc, ethertype IPv4 (0x0800), length 64: 172.31.9.69.52477 > 224.0.0.252.5355: UDP, length 22
12:38:43.140996 74:27:ea:0a:ef:47 > 33:33:00:00:00:16, ethertype IPv6 (0x86dd), length 90: fe80::554f:dc1d:5eed:c5d4 > ff02::16: HBH ICMP6, multicast listener report v2, 1 group record(s), length 28
12:38:43.141561 74:27:ea:0a:ef:47 > 33:33:00:00:00:0c, ethertype IPv6 (0x86dd), length 1246: fe80::554f:dc1d:5eed:c5d4.57743 > ff02::c.3702: UDP, length 1184
12:38:43.142548 74:27:ea:0a:ef:47 > 33:33:00:00:00:0c, ethertype IPv6 (0x86dd), length 1246: fe80::554f:dc1d:5eed:c5d4.57743 > ff02::c.3702: UDP, length 1184
12:38:43.160272 74:27:ea:0a:f0:bd > ff:ff:ff:ff:ff:ff, ethertype ARP (0x0806), length 60: Request who-has 172.31.2.88 tell 172.31.8.95, length 46
12:38:43.176787 00:09:0f:09:00:0d > 9e:6b:b9:9b:ee:6f, ethertype IPv6 (0x86dd), length 123: 2a03:2880:f00c:6:face:b00c:0:2.443 > 2001:df0:92:0:a46d:28fa:eda4:6973.54089: Flags [FP.], seq 4291724143:4291724180, ack 2512460489, win 81, options [nop,nop,TS val 1793440032 ecr 107326], length 37
12:38:43.193492 d8:24:bd:91:5d:40 > 74:27:ea:0b:7d:09, ethertype IPv4 (0x0800), length 841: 180.179.182.130.25002 > 172.31.4.140.55520: Flags [P.], seq 1149:1936, ack 1, win 512, length 787
12:38:43.204603 d8:24:bd:91:5d:40 > 30:10:b3:5f:08:08, ethertype IPv4 (0x0800), length 66: 52.32.150.180.443 > 172.31.11.94.38654: Flags [.], ack 964802917, win 66, options [nop,nop,TS val 45064239 ecr 770814], length 0
12:38:43.219609 00:1e:8c:c7:41:28 > 00:15:17:ea:f3:a8, ethertype IPv4 (0x0800), length 60: 172.31.11.91.53689 > 172.31.1.135.3128: Flags [.], ack 3678293944, win 254, length 0
12:38:43.219881 fc:4d:d4:f5:d9:77 > 00:15:17:98:d0:14, ethertype IPv4 (0x0800), length 66: 172.31.2.254.49568 > 172.31.1.227.22: Flags [.], ack 1468733301, win 252, options [nop,nop,sack 1 {4294967165:1}], length 0
12:38:43.228704 00:09:0f:09:00:0d > 6c:ae:8b:54:9c:42, ethertype IPv4 (0x0800), length 78: 221.229.172.97.54717 > 172.31.1.182.22: Flags [.], ack 2216600870, win 237, options [nop,nop,TS val 3980709 ecr 1638979891,nop,nop,sack 1 {1449:1641}], length 0
12:38:43.232978 d8:24:bd:91:5d:40 > fc:4d:d4:f5:db:e5, ethertype IPv4 (0x0800), length 60: 172.20.41.26.7349 > 172.31.4.173.22: Flags [.], ack 81, win 16128, length 0
12:38:43.251301 74:27:ea:0a:ef:47 > 33:33:00:00:00:0c, ethertype IPv6 (0x86dd), length 1246: fe80::554f:dc1d:5eed:c5d4.57743 > ff02::c.3702: UDP, length 1184
12:38:43.265995 30:8d:99:bd:50:d5 > ff:ff:ff:ff:ff:ff, ethertype ARP (0x0806), length 60: Request who-has 172.31.1.250 tell 172.31.15.207, length 46
12:38:43.266642 00:1e:8c:c7:41:28 > 00:15:17:ea:f3:a8, ethertype IPv4 (0x0800), length 2974: 172.31.11.91.53689 > 172.31.1.135.3128: Flags [.], seq 0:2920, ack 1, win 254, length 2920
12:38:43.266813 00:1e:8c:c7:41:28 > 00:15:17:ea:f3:a8, ethertype IPv4 (0x0800), length 1514: 172.31.11.91.53689 > 172.31.1.135.3128: Flags [.], seq 2920:4380, ack 1, win 254, length 1460
12:38:43.266981 00:1e:8c:c7:41:28 > 00:15:17:ea:f3:a8, ethertype IPv4 (0x0800), length 2974: 172.31.11.91.53689 > 172.31.1.135.3128: Flags [.], seq 4380:7300, ack 1, win 254, length 2920
12:38:43.267180 00:1e:8c:c7:41:28 > 00:15:17:ea:f3:a8, ethertype IPv4 (0x0800), length 1514: 172.31.11.91.53689 > 172.31.1.135.3128: Flags [.], seq 7300:8760, ack 1, win 254, length 1460
12:38:43.267423 00:1e:8c:c7:41:28 > 00:15:17:ea:f3:a8, ethertype IPv4 (0x0800), length 2974: 172.31.11.91.53689 > 172.31.1.135.3128: Flags [.], seq 8760:11680, ack 1, win 254, length 2920
12:38:43.267585 00:1e:8c:c7:41:28 > 00:15:17:ea:f3:a8, ethertype IPv4 (0x0800), length 1514: 172.31.11.91.53689 > 172.31.1.135.3128: Flags [.], seq 11680:13140, ack 1, win 254, length 1460
12:38:43.267872 00:1e:8c:c7:41:28 > 00:15:17:ea:f3:a8, ethertype IPv4 (0x0800), length 2974: 172.31.11.91.53689 > 172.31.1.135.3128: Flags [P.], seq 13140:16060, ack 1, win 254, length 2920
12:38:43.267876 00:1e:8c:c7:41:28 > 00:15:17:ea:f3:a8, ethertype IPv4 (0x0800), length 391: 172.31.11.91.53689 > 172.31.1.135.3128: Flags [P.], seq 16060:16397, ack 1, win 254, length 337
12:38:43.278124 00:09:0f:09:00:0d > e8:50:8b:6b:72:d4, ethertype IPv6 (0x86dd), length 86: fe80::209:fff:fe09:d > 2001:df0:92:0:201f:66d4:cff5:de31: ICMP6, neighbor solicitation, who has 2001:df0:92:0:201f:66d4:cff5:de31, length 32
12:38:43.280965 00:14:c2:3d:6b:ea > ff:ff:ff:ff:ff:ff, ethertype ARP (0x0806), length 60: Request who-has 172.31.1.11 tell 172.31.1.117, length 46
12:38:43.297802 00:1e:8c:c7:41:28 > 00:15:17:ea:f3:a8, ethertype IPv4 (0x0800), length 1514: 172.31.11.91.53689 > 172.31.1.135.3128: Flags [.], seq 16397:17857, ack 1, win 254, length 1460
12:38:43.298045 00:1e:8c:c7:41:28 > 00:15:17:ea:f3:a8, ethertype IPv4 (0x0800), length 2974: 172.31.11.91.53689 > 172.31.1.135.3128: Flags [.], seq 17857:20777, ack 1, win 254, length 2920
12:38:43.298230 00:1e:8c:c7:41:28 > 00:15:17:ea:f3:a8, ethertype IPv4 (0x0800), length 2974: 172.31.11.91.53689 > 172.31.1.135.3128: Flags [.], seq 20777:23697, ack 1, win 254, length 2920
12:38:43.298404 00:1e:8c:c7:41:28 > 00:15:17:ea:f3:a8, ethertype IPv4 (0x0800), length 1514: 172.31.11.91.53689 > 172.31.1.135.3128: Flags [.], seq 23697:25157, ack 1, win 254, length 1460
12:38:43.298606 00:1e:8c:c7:41:28 > 00:15:17:ea:f3:a8, ethertype IPv4 (0x0800), length 2974: 172.31.11.91.53689 > 172.31.1.135.3128: Flags [.], seq 25157:28077, ack 1, win 254, length 2920
12:38:43.298822 00:1e:8c:c7:41:28 > 00:15:17:ea:f3:a8, ethertype IPv4 (0x0800), length 1514: 172.31.11.91.53689 > 172.31.1.135.3128: Flags [.], seq 28077:29537, ack 1, win 254, length 1460
12:38:43.299032 00:1e:8c:c7:41:28 > 00:15:17:ea:f3:a8, ethertype IPv4 (0x0800), length 2974: 172.31.11.91.53689 > 172.31.1.135.3128: Flags [P.], seq 29537:32457, ack 1, win 254, length 2920
12:38:43.299036 00:1e:8c:c7:41:28 > 00:15:17:ea:f3:a8, ethertype IPv4 (0x0800), length 391: 172.31.11.91.53689 > 172.31.1.135.3128: Flags [P.], seq 32457:32794, ack 1, win 254, length 337
12:38:43.324656 00:1e:8c:c7:41:28 > 00:15:17:ea:f3:a8, ethertype IPv4 (0x0800), length 1514: 172.31.11.91.53689 > 172.31.1.135.3128: Flags [.], seq 32794:34254, ack 1, win 254, length 1460
12:38:43.324851 00:1e:8c:c7:41:28 > 00:15:17:ea:f3:a8, ethertype IPv4 (0x0800), length 1514: 172.31.11.91.53689 > 172.31.1.135.3128: Flags [.], seq 34254:35714, ack 1, win 254, length 1460
12:38:43.325075 00:1e:8c:c7:41:28 > 00:15:17:ea:f3:a8, ethertype IPv4 (0x0800), length 4434: 172.31.11.91.53689 > 172.31.1.135.3128: Flags [.], seq 35714:40094, ack 1, win 254, length 4380
12:38:43.325271 00:1e:8c:c7:41:28 > 00:15:17:ea:f3:a8, ethertype IPv4 (0x0800), length 1514: 172.31.11.91.53689 > 172.31.1.135.3128: Flags [.], seq 40094:41554, ack 1, win 254, length 1460
12:38:43.325491 00:1e:8c:c7:41:28 > 00:15:17:ea:f3:a8, ethertype IPv4 (0x0800), length 2974: 172.31.11.91.53689 > 172.31.1.135.3128: Flags [.], seq 41554:44474, ack 1, win 254, length 2920
12:38:43.325696 00:1e:8c:c7:41:28 > 00:15:17:ea:f3:a8, ethertype IPv4 (0x0800), length 1514: 172.31.11.91.53689 > 172.31.1.135.3128: Flags [.], seq 44474:45934, ack 1, win 254, length 1460
12:38:43.325892 00:1e:8c:c7:41:28 > 00:15:17:ea:f3:a8, ethertype IPv4 (0x0800), length 2974: 172.31.11.91.53689 > 172.31.1.135.3128: Flags [P.], seq 45934:48854, ack 1, win 254, length 2920
12:38:43.325895 00:1e:8c:c7:41:28 > 00:15:17:ea:f3:a8, ethertype IPv4 (0x0800), length 391: 172.31.11.91.53689 > 172.31.1.135.3128: Flags [P.], seq 48854:49191, ack 1, win 254, length 337
12:38:43.347518 00:1e:8c:c7:41:28 > 00:15:17:ea:f3:a8, ethertype IPv4 (0x0800), length 1514: 172.31.11.91.53689 > 172.31.1.135.3128: Flags [.], seq 49191:50651, ack 1, win 254, length 1460
12:38:43.347759 00:1e:8c:c7:41:28 > 00:15:17:ea:f3:a8, ethertype IPv4 (0x0800), length 2974: 172.31.11.91.53689 > 172.31.1.135.3128: Flags [.], seq 50651:53571, ack 1, win 254, length 2920
12:38:43.347949 00:1e:8c:c7:41:28 > 00:15:17:ea:f3:a8, ethertype IPv4 (0x0800), length 1514: 172.31.11.91.53689 > 172.31.1.135.3128: Flags [.], seq 53571:55031, ack 1, win 254, length 1460
12:38:43.348153 00:1e:8c:c7:41:28 > 00:15:17:ea:f3:a8, ethertype IPv4 (0x0800), length 2974: 172.31.11.91.53689 > 172.31.1.135.3128: Flags [.], seq 55031:57951, ack 1, win 254, length 2920
12:38:43.348357 00:1e:8c:c7:41:28 > 00:15:17:ea:f3:a8, ethertype IPv4 (0x0800), length 2974: 172.31.11.91.53689 > 172.31.1.135.3128: Flags [.], seq 57951:60871, ack 1, win 254, length 2920
12:38:43.348565 00:1e:8c:c7:41:28 > 00:15:17:ea:f3:a8, ethertype IPv4 (0x0800), length 1514: 172.31.11.91.53689 > 172.31.1.135.3128: Flags [.], seq 60871:62331, ack 1, win 254, length 1460
12:38:43.348730 00:1e:8c:c7:41:28 > 00:15:17:ea:f3:a8, ethertype IPv4 (0x0800), length 2974: 172.31.11.91.53689 > 172.31.1.135.3128: Flags [P.], seq 62331:65251, ack 1, win 254, length 2920
12:38:43.348734 00:1e:8c:c7:41:28 > 00:15:17:ea:f3:a8, ethertype IPv4 (0x0800), length 391: 172.31.11.91.53689 > 172.31.1.135.3128: Flags [P.], seq 65251:65588, ack 1, win 254, length 337
12:38:43.360564 74:27:ea:0a:ef:47 > 33:33:00:00:00:0c, ethertype IPv6 (0x86dd), length 1246: fe80::554f:dc1d:5eed:c5d4.57743 > ff02::c.3702: UDP, length 1184
12:38:43.363874 d8:24:bd:91:5d:40 > 00:14:c2:58:23:fd, ethertype IPv4 (0x0800), length 90: 172.20.44.130.1487 > 172.31.1.4.32887: Flags [P.], seq 9642916:9642952, ack 2059199780, win 65199, length 36
12:38:43.375994 00:1e:8c:c7:41:28 > 00:15:17:ea:f3:a8, ethertype IPv4 (0x0800), length 2974: 172.31.11.91.53689 > 172.31.1.135.3128: Flags [.], seq 65588:68508, ack 1, win 254, length 2920
12:38:43.376180 00:1e:8c:c7:41:28 > 00:15:17:ea:f3:a8, ethertype IPv4 (0x0800), length 1514: 172.31.11.91.53689 > 172.31.1.135.3128: Flags [.], seq 68508:69968, ack 1, win 254, length 1460
12:38:43.376369 00:1e:8c:c7:41:28 > 00:15:17:ea:f3:a8, ethertype IPv4 (0x0800), length 2974: 172.31.11.91.53689 > 172.31.1.135.3128: Flags [.], seq 69968:72888, ack 1, win 254, length 2920
12:38:43.376562 00:1e:8c:c7:41:28 > 00:15:17:ea:f3:a8, ethertype IPv4 (0x0800), length 1514: 172.31.11.91.53689 > 172.31.1.135.3128: Flags [.], seq 72888:74348, ack 1, win 254, length 1460
12:38:43.376798 00:1e:8c:c7:41:28 > 00:15:17:ea:f3:a8, ethertype IPv4 (0x0800), length 2974: 172.31.11.91.53689 > 172.31.1.135.3128: Flags [.], seq 74348:77268, ack 1, win 254, length 2920
12:38:43.376975 00:1e:8c:c7:41:28 > 00:15:17:ea:f3:a8, ethertype IPv4 (0x0800), length 2974: 172.31.11.91.53689 > 172.31.1.135.3128: Flags [.], seq 77268:80188, ack 1, win 254, length 2920
12:38:43.377164 00:1e:8c:c7:41:28 > 00:15:17:ea:f3:a8, ethertype IPv4 (0x0800), length 1514: 172.31.11.91.53689 > 172.31.1.135.3128: Flags [P.], seq 80188:81648, ack 1, win 254, length 1460
12:38:43.377168 00:1e:8c:c7:41:28 > 00:15:17:ea:f3:a8, ethertype IPv4 (0x0800), length 391: 172.31.11.91.53689 > 172.31.1.135.3128: Flags [P.], seq 81648:81985, ack 1, win 254, length 337
12:38:43.421044 00:1e:8c:c7:41:28 > 00:15:17:ea:f3:a8, ethertype IPv4 (0x0800), length 1514: 172.31.11.91.53689 > 172.31.1.135.3128: Flags [.], seq 81985:83445, ack 1, win 254, length 1460
12:38:43.421309 00:1e:8c:c7:41:28 > 00:15:17:ea:f3:a8, ethertype IPv4 (0x0800), length 2974: 172.31.11.91.53689 > 172.31.1.135.3128: Flags [.], seq 83445:86365, ack 1, win 254, length 2920
12:38:43.421488 00:1e:8c:c7:41:28 > 00:15:17:ea:f3:a8, ethertype IPv4 (0x0800), length 2974: 172.31.11.91.53689 > 172.31.1.135.3128: Flags [.], seq 86365:89285, ack 1, win 254, length 2920
12:38:43.421688 00:1e:8c:c7:41:28 > 00:15:17:ea:f3:a8, ethertype IPv4 (0x0800), length 1514: 172.31.11.91.53689 > 172.31.1.135.3128: Flags [.], seq 89285:90745, ack 1, win 254, length 1460
12:38:43.421932 00:1e:8c:c7:41:28 > 00:15:17:ea:f3:a8, ethertype IPv4 (0x0800), length 2974: 172.31.11.91.53689 > 172.31.1.135.3128: Flags [.], seq 90745:93665, ack 1, win 254, length 2920
12:38:43.422088 00:1e:8c:c7:41:28 > 00:15:17:ea:f3:a8, ethertype IPv4 (0x0800), length 1514: 172.31.11.91.53689 > 172.31.1.135.3128: Flags [.], seq 93665:95125, ack 1, win 254, length 1460
12:38:43.422252 00:1e:8c:c7:41:28 > 00:15:17:ea:f3:a8, ethertype IPv4 (0x0800), length 2974: 172.31.11.91.53689 > 172.31.1.135.3128: Flags [P.], seq 95125:98045, ack 1, win 254, length 2920
12:38:43.422253 00:1e:8c:c7:41:28 > 00:15:17:ea:f3:a8, ethertype IPv4 (0x0800), length 391: 172.31.11.91.53689 > 172.31.1.135.3128: Flags [P.], seq 98045:98382, ack 1, win 254, length 337
12:38:43.448089 00:09:0f:09:00:0d > 9e:6b:b9:9b:ee:6f, ethertype IPv6 (0x86dd), length 86: fe80::209:fff:fe09:d > 2001:df0:92:0:a46d:28fa:eda4:6973: ICMP6, neighbor solicitation, who has 2001:df0:92:0:a46d:28fa:eda4:6973, length 32
12:38:43.464385 d8:24:bd:91:5d:40 > ff:ff:ff:ff:ff:ff, ethertype ARP (0x0806), length 60: Request who-has 172.31.1.11 tell 172.31.1.250, length 46
12:38:43.469207 00:1e:8c:c7:41:28 > 00:15:17:ea:f3:a8, ethertype IPv4 (0x0800), length 1514: 172.31.11.91.53689 > 172.31.1.135.3128: Flags [.], seq 98382:99842, ack 1, win 254, length 1460
12:38:43.469448 00:1e:8c:c7:41:28 > 00:15:17:ea:f3:a8, ethertype IPv4 (0x0800), length 2974: 172.31.11.91.53689 > 172.31.1.135.3128: Flags [.], seq 99842:102762, ack 1, win 254, length 2920
12:38:43.469650 00:1e:8c:c7:41:28 > 00:15:17:ea:f3:a8, ethertype IPv4 (0x0800), length 2974: 172.31.11.91.53689 > 172.31.1.135.3128: Flags [.], seq 102762:105682, ack 1, win 254, length 2920
12:38:43.469817 00:1e:8c:c7:41:28 > 00:15:17:ea:f3:a8, ethertype IPv4 (0x0800), length 1514: 172.31.11.91.53689 > 172.31.1.135.3128: Flags [.], seq 105682:107142, ack 1, win 254, length 1460
12:38:43.470039 00:1e:8c:c7:41:28 > 00:15:17:ea:f3:a8, ethertype IPv4 (0x0800), length 1514: 172.31.11.91.53689 > 172.31.1.135.3128: Flags [.], seq 107142:108602, ack 1, win 254, length 1460
12:38:43.470258 00:1e:8c:c7:41:28 > 00:15:17:ea:f3:a8, ethertype IPv4 (0x0800), length 2974: 172.31.11.91.53689 > 172.31.1.135.3128: Flags [.], seq 108602:111522, ack 1, win 254, length 2920
12:38:43.470437 00:1e:8c:c7:41:28 > 00:15:17:ea:f3:a8, ethertype IPv4 (0x0800), length 2974: 172.31.11.91.53689 > 172.31.1.135.3128: Flags [P.], seq 111522:114442, ack 1, win 254, length 2920
12:38:43.470440 00:1e:8c:c7:41:28 > 00:15:17:ea:f3:a8, ethertype IPv4 (0x0800), length 391: 172.31.11.91.53689 > 172.31.1.135.3128: Flags [P.], seq 114442:114779, ack 1, win 254, length 337
12:38:43.474500 00:1e:8c:c7:41:28 > 00:15:17:ea:f3:a8, ethertype IPv4 (0x0800), length 2974: 172.31.11.91.53689 > 172.31.1.135.3128: Flags [.], seq 114779:117699, ack 1, win 254, length 2920
12:38:43.474675 00:1e:8c:c7:41:28 > 00:15:17:ea:f3:a8, ethertype IPv4 (0x0800), length 1514: 172.31.11.91.53689 > 172.31.1.135.3128: Flags [.], seq 117699:119159, ack 1, win 254, length 1460
12:38:43.474863 00:1e:8c:c7:41:28 > 00:15:17:ea:f3:a8, ethertype IPv4 (0x0800), length 2974: 172.31.11.91.53689 > 172.31.1.135.3128: Flags [.], seq 119159:122079, ack 1, win 254, length 2920
12:38:43.475110 00:1e:8c:c7:41:28 > 00:15:17:ea:f3:a8, ethertype IPv4 (0x0800), length 1514: 172.31.11.91.53689 > 172.31.1.135.3128: Flags [.], seq 122079:123539, ack 1, win 254, length 1460
12:38:43.475291 00:1e:8c:c7:41:28 > 00:15:17:ea:f3:a8, ethertype IPv4 (0x0800), length 2974: 172.31.11.91.53689 > 172.31.1.135.3128: Flags [.], seq 123539:126459, ack 1, win 254, length 2920
12:38:43.475443 00:1e:8c:c7:41:28 > 00:15:17:ea:f3:a8, ethertype IPv4 (0x0800), length 1514: 172.31.11.91.53689 > 172.31.1.135.3128: Flags [.], seq 126459:127919, ack 1, win 254, length 1460
12:38:43.475655 00:1e:8c:c7:41:28 > 00:15:17:ea:f3:a8, ethertype IPv4 (0x0800), length 2974: 172.31.11.91.53689 > 172.31.1.135.3128: Flags [P.], seq 127919:130839, ack 1, win 254, length 2920
12:38:43.475657 00:1e:8c:c7:41:28 > 00:15:17:ea:f3:a8, ethertype IPv4 (0x0800), length 391: 172.31.11.91.53689 > 172.31.1.135.3128: Flags [P.], seq 130839:131176, ack 1, win 254, length 337
12:38:43.480516 00:1e:8c:c7:41:28 > 00:15:17:ea:f3:a8, ethertype IPv4 (0x0800), length 1514: 172.31.11.91.53689 > 172.31.1.135.3128: Flags [.], seq 131176:132636, ack 1, win 254, length 1460
12:38:43.480695 00:1e:8c:c7:41:28 > 00:15:17:ea:f3:a8, ethertype IPv4 (0x0800), length 2974: 172.31.11.91.53689 > 172.31.1.135.3128: Flags [.], seq 132636:135556, ack 1, win 254, length 2920
12:38:43.480857 00:1e:8c:c7:41:28 > 00:15:17:ea:f3:a8, ethertype IPv4 (0x0800), length 1514: 172.31.11.91.53689 > 172.31.1.135.3128: Flags [.], seq 135556:137016, ack 1, win 254, length 1460
12:38:43.481065 00:1e:8c:c7:41:28 > 00:15:17:ea:f3:a8, ethertype IPv4 (0x0800), length 2974: 172.31.11.91.53689 > 172.31.1.135.3128: Flags [.], seq 137016:139936, ack 1, win 254, length 2920
12:38:43.481312 00:1e:8c:c7:41:28 > 00:15:17:ea:f3:a8, ethertype IPv4 (0x0800), length 2974: 172.31.11.91.53689 > 172.31.1.135.3128: Flags [.], seq 139936:142856, ack 1, win 254, length 2920
12:38:43.481472 00:1e:8c:c7:41:28 > 00:15:17:ea:f3:a8, ethertype IPv4 (0x0800), length 1514: 172.31.11.91.53689 > 172.31.1.135.3128: Flags [.], seq 142856:144316, ack 1, win 254, length 1460
12:38:43.481679 00:1e:8c:c7:41:28 > 00:15:17:ea:f3:a8, ethertype IPv4 (0x0800), length 2974: 172.31.11.91.53689 > 172.31.1.135.3128: Flags [P.], seq 144316:147236, ack 1, win 254, length 2920
12:38:43.481682 00:1e:8c:c7:41:28 > 00:15:17:ea:f3:a8, ethertype IPv4 (0x0800), length 391: 172.31.11.91.53689 > 172.31.1.135.3128: Flags [P.], seq 147236:147573, ack 1, win 254, length 337
12:38:43.485298 74:27:ea:0a:ef:47 > 33:33:00:01:00:03, ethertype IPv6 (0x86dd), length 87: fe80::554f:dc1d:5eed:c5d4.59840 > ff02::1:3.5355: UDP, length 25
12:38:43.485535 74:27:ea:0a:ef:47 > 01:00:5e:00:00:fc, ethertype IPv4 (0x0800), length 67: 172.31.9.69.59840 > 224.0.0.252.5355: UDP, length 25
12:38:43.547832 00:1e:8c:c7:41:28 > 00:15:17:ea:f3:a8, ethertype IPv4 (0x0800), length 1514: 172.31.11.91.53689 > 172.31.1.135.3128: Flags [.], seq 147573:149033, ack 1, win 254, length 1460
12:38:43.548017 74:27:ea:0a:ef:47 > 01:00:5e:00:00:fc, ethertype IPv4 (0x0800), length 64: 172.31.9.69.55619 > 224.0.0.252.5355: UDP, length 22
12:38:43.548021 74:27:ea:0a:ef:47 > 01:00:5e:00:00:fc, ethertype IPv4 (0x0800), length 64: 172.31.9.69.49303 > 224.0.0.252.5355: UDP, length 22
12:38:43.548023 00:1e:8c:c7:41:28 > 00:15:17:ea:f3:a8, ethertype IPv4 (0x0800), length 2974: 172.31.11.91.53689 > 172.31.1.135.3128: Flags [.], seq 149033:151953, ack 1, win 254, length 2920
12:38:43.548273 00:1e:8c:c7:41:28 > 00:15:17:ea:f3:a8, ethertype IPv4 (0x0800), length 1514: 172.31.11.91.53689 > 172.31.1.135.3128: Flags [.], seq 151953:153413, ack 1, win 254, length 1460
12:38:43.548532 74:27:ea:0a:ef:47 > 01:00:5e:00:00:fc, ethertype IPv4 (0x0800), length 64: 172.31.9.69.52477 > 224.0.0.252.5355: UDP, length 22
12:38:43.548537 74:27:ea:0a:ef:47 > 01:00:5e:00:00:fc, ethertype IPv4 (0x0800), length 64: 172.31.9.69.62914 > 224.0.0.252.5355: UDP, length 22
12:38:43.548541 00:1e:8c:c7:41:28 > 00:15:17:ea:f3:a8, ethertype IPv4 (0x0800), length 4434: 172.31.11.91.53689 > 172.31.1.135.3128: Flags [.], seq 153413:157793, ack 1, win 254, length 4380
12:38:43.548650 00:1e:8c:c7:41:28 > 00:15:17:ea:f3:a8, ethertype IPv4 (0x0800), length 1514: 172.31.11.91.53689 > 172.31.1.135.3128: Flags [.], seq 157793:159253, ack 1, win 254, length 1460
12:38:43.548898 00:1e:8c:c7:41:28 > 00:15:17:ea:f3:a8, ethertype IPv4 (0x0800), length 1514: 172.31.11.91.53689 > 172.31.1.135.3128: Flags [.], seq 159253:160713, ack 1, win 254, length 1460
12:38:43.549058 00:1e:8c:c7:41:28 > 00:15:17:ea:f3:a8, ethertype IPv4 (0x0800), length 2974: 172.31.11.91.53689 > 172.31.1.135.3128: Flags [P.], seq 160713:163633, ack 1, win 254, length 2920
12:38:43.549063 74:27:ea:0a:ef:47 > 33:33:00:01:00:03, ethertype IPv6 (0x86dd), length 84: fe80::554f:dc1d:5eed:c5d4.55619 > ff02::1:3.5355: UDP, length 22
12:38:43.549071 74:27:ea:0a:ef:47 > 33:33:00:01:00:03, ethertype IPv6 (0x86dd), length 84: fe80::554f:dc1d:5eed:c5d4.49303 > ff02::1:3.5355: UDP, length 22
12:38:43.549072 74:27:ea:0a:ef:47 > 33:33:00:01:00:03, ethertype IPv6 (0x86dd), length 84: fe80::554f:dc1d:5eed:c5d4.52477 > ff02::1:3.5355: UDP, length 22
12:38:43.549074 00:1e:8c:c7:41:28 > 00:15:17:ea:f3:a8, ethertype IPv4 (0x0800), length 391: 172.31.11.91.53689 > 172.31.1.135.3128: Flags [P.], seq 163633:163970, ack 1, win 254, length 337
12:38:43.549075 74:27:ea:0a:ef:47 > 33:33:00:01:00:03, ethertype IPv6 (0x86dd), length 84: fe80::554f:dc1d:5eed:c5d4.62914 > ff02::1:3.5355: UDP, length 22
12:38:43.558197 00:1e:8c:c7:41:28 > 00:15:17:ea:f3:a8, ethertype IPv4 (0x0800), length 1514: 172.31.11.91.53689 > 172.31.1.135.3128: Flags [.], seq 163970:165430, ack 1, win 254, length 1460
12:38:43.558468 00:1e:8c:c7:41:28 > 00:15:17:ea:f3:a8, ethertype IPv4 (0x0800), length 2974: 172.31.11.91.53689 > 172.31.1.135.3128: Flags [.], seq 165430:168350, ack 1, win 254, length 2920
12:38:43.558565 00:1e:8c:c7:41:28 > 00:15:17:ea:f3:a8, ethertype IPv4 (0x0800), length 2974: 172.31.11.91.53689 > 172.31.1.135.3128: Flags [.], seq 168350:171270, ack 1, win 254, length 2920
12:38:43.558836 00:1e:8c:c7:41:28 > 00:15:17:ea:f3:a8, ethertype IPv4 (0x0800), length 1514: 172.31.11.91.53689 > 172.31.1.135.3128: Flags [.], seq 171270:172730, ack 1, win 254, length 1460
12:38:43.559018 00:1e:8c:c7:41:28 > 00:15:17:ea:f3:a8, ethertype IPv4 (0x0800), length 2974: 172.31.11.91.53689 > 172.31.1.135.3128: Flags [.], seq 172730:175650, ack 1, win 254, length 2920
12:38:43.559203 00:1e:8c:c7:41:28 > 00:15:17:ea:f3:a8, ethertype IPv4 (0x0800), length 2974: 172.31.11.91.53689 > 172.31.1.135.3128: Flags [.], seq 175650:178570, ack 1, win 254, length 2920
12:38:43.559450 00:1e:8c:c7:41:28 > 00:15:17:ea:f3:a8, ethertype IPv4 (0x0800), length 1514: 172.31.11.91.53689 > 172.31.1.135.3128: Flags [P.], seq 178570:180030, ack 1, win 254, length 1460
12:38:43.559453 00:1e:8c:c7:41:28 > 00:15:17:ea:f3:a8, ethertype IPv4 (0x0800), length 391: 172.31.11.91.53689 > 172.31.1.135.3128: Flags [P.], seq 180030:180367, ack 1, win 254, length 337
12:38:43.575676 d8:24:bd:91:5d:40 > 00:15:17:98:d1:bc, ethertype IPv4 (0x0800), length 90: 172.20.40.230.49446 > 172.31.1.198.37327: Flags [P.], seq 3711940262:3711940298, ack 338730275, win 16089, length 36
12:38:43.593371 00:1e:8c:c7:41:28 > 00:15:17:ea:f3:a8, ethertype IPv4 (0x0800), length 1514: 172.31.11.91.53689 > 172.31.1.135.3128: Flags [.], seq 180367:181827, ack 1, win 254, length 1460
12:38:43.593596 00:1e:8c:c7:41:28 > 00:15:17:ea:f3:a8, ethertype IPv4 (0x0800), length 2974: 172.31.11.91.53689 > 172.31.1.135.3128: Flags [.], seq 181827:184747, ack 1, win 254, length 2920
12:38:43.593807 00:1e:8c:c7:41:28 > 00:15:17:ea:f3:a8, ethertype IPv4 (0x0800), length 1514: 172.31.11.91.53689 > 172.31.1.135.3128: Flags [.], seq 184747:186207, ack 1, win 254, length 1460
12:38:43.593983 00:1e:8c:c7:41:28 > 00:15:17:ea:f3:a8, ethertype IPv4 (0x0800), length 2974: 172.31.11.91.53689 > 172.31.1.135.3128: Flags [.], seq 186207:189127, ack 1, win 254, length 2920
12:38:43.594212 00:1e:8c:c7:41:28 > 00:15:17:ea:f3:a8, ethertype IPv4 (0x0800), length 2974: 172.31.11.91.53689 > 172.31.1.135.3128: Flags [.], seq 189127:192047, ack 1, win 254, length 2920
12:38:43.594396 00:1e:8c:c7:41:28 > 00:15:17:ea:f3:a8, ethertype IPv4 (0x0800), length 1514: 172.31.11.91.53689 > 172.31.1.135.3128: Flags [.], seq 192047:193507, ack 1, win 254, length 1460
12:38:43.594606 00:1e:8c:c7:41:28 > 00:15:17:ea:f3:a8, ethertype IPv4 (0x0800), length 2974: 172.31.11.91.53689 > 172.31.1.135.3128: Flags [P.], seq 193507:196427, ack 1, win 254, length 2920
12:38:43.594636 00:1e:8c:c7:41:28 > 00:15:17:ea:f3:a8, ethertype IPv4 (0x0800), length 391: 172.31.11.91.53689 > 172.31.1.135.3128: Flags [P.], seq 196427:196764, ack 1, win 254, length 337
12:38:43.602494 d8:24:bd:91:5d:40 > 60:36:dd:42:8d:2b, ethertype IPv4 (0x0800), length 60: 14.139.247.8.80 > 172.31.8.25.59070: Flags [F.], seq 1034600882, ack 3117267713, win 3348, length 0
12:38:43.602500 d8:24:bd:91:5d:40 > 60:36:dd:42:8d:2b, ethertype IPv4 (0x0800), length 60: 14.139.247.8.80 > 172.31.8.25.59070: Flags [F.], seq 0, ack 1, win 3348, length 0
12:38:43.630685 74:27:ea:0a:ef:47 > 33:33:00:00:00:16, ethertype IPv6 (0x86dd), length 90: fe80::554f:dc1d:5eed:c5d4 > ff02::16: HBH ICMP6, multicast listener report v2, 1 group record(s), length 28
12:38:43.641604 00:1e:8c:c7:41:28 > 00:15:17:ea:f3:a8, ethertype IPv4 (0x0800), length 1514: 172.31.11.91.53689 > 172.31.1.135.3128: Flags [.], seq 196764:198224, ack 1, win 254, length 1460
12:38:43.641880 00:1e:8c:c7:41:28 > 00:15:17:ea:f3:a8, ethertype IPv4 (0x0800), length 4434: 172.31.11.91.53689 > 172.31.1.135.3128: Flags [.], seq 198224:202604, ack 1, win 254, length 4380
12:38:43.642097 00:1e:8c:c7:41:28 > 00:15:17:ea:f3:a8, ethertype IPv4 (0x0800), length 1514: 172.31.11.91.53689 > 172.31.1.135.3128: Flags [.], seq 202604:204064, ack 1, win 254, length 1460
12:38:43.642354 00:1e:8c:c7:41:28 > 00:15:17:ea:f3:a8, ethertype IPv4 (0x0800), length 2974: 172.31.11.91.53689 > 172.31.1.135.3128: Flags [.], seq 204064:206984, ack 1, win 254, length 2920
12:38:43.642490 00:1e:8c:c7:41:28 > 00:15:17:ea:f3:a8, ethertype IPv4 (0x0800), length 2974: 172.31.11.91.53689 > 172.31.1.135.3128: Flags [.], seq 206984:209904, ack 1, win 254, length 2920
12:38:43.642722 00:1e:8c:c7:41:28 > 00:15:17:ea:f3:a8, ethertype IPv4 (0x0800), length 1514: 172.31.11.91.53689 > 172.31.1.135.3128: Flags [.], seq 209904:211364, ack 1, win 254, length 1460
12:38:43.643016 00:1e:8c:c7:41:28 > 00:15:17:ea:f3:a8, ethertype IPv4 (0x0800), length 1514: 172.31.11.91.53689 > 172.31.1.135.3128: Flags [P.], seq 211364:212824, ack 1, win 254, length 1460
12:38:43.643020 00:1e:8c:c7:41:28 > 00:15:17:ea:f3:a8, ethertype IPv4 (0x0800), length 391: 172.31.11.91.53689 > 172.31.1.135.3128: Flags [P.], seq 212824:213161, ack 1, win 254, length 337
12:38:43.643021 00:23:54:31:a3:76 > 2c:44:fd:8f:3b:08, ethertype IPv4 (0x0800), length 102: 172.31.4.227.40501 > 172.31.7.69.22: Flags [P.], seq 3444643920:3444643968, ack 2712358443, win 501, length 48
12:38:43.692998 00:1e:8c:c7:41:28 > 00:15:17:ea:f3:a8, ethertype IPv4 (0x0800), length 2974: 172.31.11.91.53689 > 172.31.1.135.3128: Flags [.], seq 213161:216081, ack 1, win 254, length 2920
12:38:43.693112 00:1e:8c:c7:41:28 > 00:15:17:ea:f3:a8, ethertype IPv4 (0x0800), length 1514: 172.31.11.91.53689 > 172.31.1.135.3128: Flags [.], seq 216081:217541, ack 1, win 254, length 1460
12:38:43.693312 00:1e:8c:c7:41:28 > 00:15:17:ea:f3:a8, ethertype IPv4 (0x0800), length 1514: 172.31.11.91.53689 > 172.31.1.135.3128: Flags [.], seq 217541:219001, ack 1, win 254, length 1460
12:38:43.693580 00:1e:8c:c7:41:28 > 00:15:17:ea:f3:a8, ethertype IPv4 (0x0800), length 2974: 172.31.11.91.53689 > 172.31.1.135.3128: Flags [.], seq 219001:221921, ack 1, win 254, length 2920
12:38:43.693817 00:1e:8c:c7:41:28 > 00:15:17:ea:f3:a8, ethertype IPv4 (0x0800), length 2974: 172.31.11.91.53689 > 172.31.1.135.3128: Flags [.], seq 221921:224841, ack 1, win 254, length 2920
12:38:43.693943 00:1e:8c:c7:41:28 > 00:15:17:ea:f3:a8, ethertype IPv4 (0x0800), length 1514: 172.31.11.91.53689 > 172.31.1.135.3128: Flags [.], seq 224841:226301, ack 1, win 254, length 1460
12:38:43.694103 00:1e:8c:c7:41:28 > 00:15:17:ea:f3:a8, ethertype IPv4 (0x0800), length 2974: 172.31.11.91.53689 > 172.31.1.135.3128: Flags [P.], seq 226301:229221, ack 1, win 254, length 2920
12:38:43.694104 00:1e:8c:c7:41:28 > 00:15:17:ea:f3:a8, ethertype IPv4 (0x0800), length 391: 172.31.11.91.53689 > 172.31.1.135.3128: Flags [P.], seq 229221:229558, ack 1, win 254, length 337
12:38:43.721490 00:1e:8c:c7:41:28 > 00:15:17:ea:f3:a8, ethertype IPv4 (0x0800), length 2974: 172.31.11.91.53689 > 172.31.1.135.3128: Flags [.], seq 229558:232478, ack 1, win 254, length 2920
12:38:43.721714 00:1e:8c:c7:41:28 > 00:15:17:ea:f3:a8, ethertype IPv4 (0x0800), length 1514: 172.31.11.91.53689 > 172.31.1.135.3128: Flags [.], seq 232478:233938, ack 1, win 254, length 1460
12:38:43.721854 00:1e:8c:c7:41:28 > 00:15:17:ea:f3:a8, ethertype IPv4 (0x0800), length 2974: 172.31.11.91.53689 > 172.31.1.135.3128: Flags [.], seq 233938:236858, ack 1, win 254, length 2920
12:38:43.722000 00:1e:8c:c7:41:28 > 00:15:17:ea:f3:a8, ethertype IPv4 (0x0800), length 1514: 172.31.11.91.53689 > 172.31.1.135.3128: Flags [.], seq 236858:238318, ack 1, win 254, length 1460
12:38:43.722286 00:1e:8c:c7:41:28 > 00:15:17:ea:f3:a8, ethertype IPv4 (0x0800), length 2974: 172.31.11.91.53689 > 172.31.1.135.3128: Flags [.], seq 238318:241238, ack 1, win 254, length 2920
12:38:43.722469 00:1e:8c:c7:41:28 > 00:15:17:ea:f3:a8, ethertype IPv4 (0x0800), length 2974: 172.31.11.91.53689 > 172.31.1.135.3128: Flags [.], seq 241238:244158, ack 1, win 254, length 2920
12:38:43.722729 00:1e:8c:c7:41:28 > 00:15:17:ea:f3:a8, ethertype IPv4 (0x0800), length 1514: 172.31.11.91.53689 > 172.31.1.135.3128: Flags [P.], seq 244158:245618, ack 1, win 254, length 1460
12:38:43.722732 00:1e:8c:c7:41:28 > 00:15:17:ea:f3:a8, ethertype IPv4 (0x0800), length 391: 172.31.11.91.53689 > 172.31.1.135.3128: Flags [P.], seq 245618:245955, ack 1, win 254, length 337
12:38:43.726788 00:1e:8c:c7:41:28 > 00:15:17:ea:f3:a8, ethertype IPv4 (0x0800), length 1514: 172.31.11.91.53689 > 172.31.1.135.3128: Flags [.], seq 245955:247415, ack 1, win 254, length 1460
12:38:43.727035 00:1e:8c:c7:41:28 > 00:15:17:ea:f3:a8, ethertype IPv4 (0x0800), length 2974: 172.31.11.91.53689 > 172.31.1.135.3128: Flags [.], seq 247415:250335, ack 1, win 254, length 2920
12:38:43.727215 00:1e:8c:c7:41:28 > 00:15:17:ea:f3:a8, ethertype IPv4 (0x0800), length 2974: 172.31.11.91.53689 > 172.31.1.135.3128: Flags [.], seq 250335:253255, ack 1, win 254, length 2920
12:38:43.727400 00:1e:8c:c7:41:28 > 00:15:17:ea:f3:a8, ethertype IPv4 (0x0800), length 1514: 172.31.11.91.53689 > 172.31.1.135.3128: Flags [.], seq 253255:254715, ack 1, win 254, length 1460
12:38:43.727638 00:1e:8c:c7:41:28 > 00:15:17:ea:f3:a8, ethertype IPv4 (0x0800), length 2974: 172.31.11.91.53689 > 172.31.1.135.3128: Flags [.], seq 254715:257635, ack 1, win 254, length 2920
12:38:43.727830 00:1e:8c:c7:41:28 > 00:15:17:ea:f3:a8, ethertype IPv4 (0x0800), length 2974: 172.31.11.91.53689 > 172.31.1.135.3128: Flags [.], seq 257635:260555, ack 1, win 254, length 2920
12:38:43.728019 00:1e:8c:c7:41:28 > 00:15:17:ea:f3:a8, ethertype IPv4 (0x0800), length 1514: 172.31.11.91.53689 > 172.31.1.135.3128: Flags [P.], seq 260555:262015, ack 1, win 254, length 1460
12:38:43.728023 00:1e:8c:c7:41:28 > 00:15:17:ea:f3:a8, ethertype IPv4 (0x0800), length 391: 172.31.11.91.53689 > 172.31.1.135.3128: Flags [P.], seq 262015:262352, ack 1, win 254, length 337
12:38:43.761026 00:1e:8c:c7:41:28 > 00:15:17:ea:f3:a8, ethertype IPv4 (0x0800), length 2974: 172.31.11.91.53689 > 172.31.1.135.3128: Flags [.], seq 262352:265272, ack 1, win 254, length 2920
12:38:43.761199 00:1e:8c:c7:41:28 > 00:15:17:ea:f3:a8, ethertype IPv4 (0x0800), length 1514: 172.31.11.91.53689 > 172.31.1.135.3128: Flags [.], seq 265272:266732, ack 1, win 254, length 1460
12:38:43.761381 00:1e:8c:c7:41:28 > 00:15:17:ea:f3:a8, ethertype IPv4 (0x0800), length 2974: 172.31.11.91.53689 > 172.31.1.135.3128: Flags [.], seq 266732:269652, ack 1, win 254, length 2920
12:38:43.761585 00:1e:8c:c7:41:28 > 00:15:17:ea:f3:a8, ethertype IPv4 (0x0800), length 1514: 172.31.11.91.53689 > 172.31.1.135.3128: Flags [.], seq 269652:271112, ack 1, win 254, length 1460
12:38:43.761826 00:1e:8c:c7:41:28 > 00:15:17:ea:f3:a8, ethertype IPv4 (0x0800), length 2974: 172.31.11.91.53689 > 172.31.1.135.3128: Flags [.], seq 271112:274032, ack 1, win 254, length 2920
12:38:43.761983 00:1e:8c:c7:41:28 > 00:15:17:ea:f3:a8, ethertype IPv4 (0x0800), length 1514: 172.31.11.91.53689 > 172.31.1.135.3128: Flags [.], seq 274032:275492, ack 1, win 254, length 1460
12:38:43.762146 00:1e:8c:c7:41:28 > 00:15:17:ea:f3:a8, ethertype IPv4 (0x0800), length 2974: 172.31.11.91.53689 > 172.31.1.135.3128: Flags [P.], seq 275492:278412, ack 1, win 254, length 2920
12:38:43.762148 00:1e:8c:c7:41:28 > 00:15:17:ea:f3:a8, ethertype IPv4 (0x0800), length 391: 172.31.11.91.53689 > 172.31.1.135.3128: Flags [P.], seq 278412:278749, ack 1, win 254, length 337
12:38:43.784952 d8:24:bd:91:5d:40 > d8:d3:85:ba:9f:80, ethertype IPv4 (0x0800), length 66: 172.26.158.4.55060 > 172.31.1.127.8014: Flags [S], seq 146933747, win 8192, options [mss 1460,nop,wscale 2,nop,nop,sackOK], length 0
12:38:43.867088 d8:24:bd:91:5d:40 > 4c:00:82:71:7e:e4, ethertype IPv4 (0x0800), length 118: 172.31.1.250 > 172.31.1.34: ICMP echo reply, id 0, seq 0, length 84
12:38:43.875959 74:27:ea:0a:ef:47 > ff:ff:ff:ff:ff:ff, ethertype IPv4 (0x0800), length 92: 172.31.9.69.137 > 172.31.255.255.137: NBT UDP PACKET(137): QUERY; REQUEST; BROADCAST
12:38:43.875973 74:27:ea:0a:ef:47 > ff:ff:ff:ff:ff:ff, ethertype IPv4 (0x0800), length 92: 172.31.9.69.137 > 172.31.255.255.137: NBT UDP PACKET(137): QUERY; REQUEST; BROADCAST
12:38:43.908452 74:27:ea:0a:ef:47 > 33:33:00:00:00:16, ethertype IPv6 (0x86dd), length 90: fe80::554f:dc1d:5eed:c5d4 > ff02::16: HBH ICMP6, multicast listener report v2, 1 group record(s), length 28
12:38:43.908748 74:27:ea:0a:ef:47 > 33:33:00:01:00:03, ethertype IPv6 (0x86dd), length 87: fe80::554f:dc1d:5eed:c5d4.60252 > ff02::1:3.5355: UDP, length 25
12:38:43.908755 74:27:ea:0a:ef:47 > 01:00:5e:00:00:fc, ethertype IPv4 (0x0800), length 67: 172.31.9.69.60252 > 224.0.0.252.5355: UDP, length 25
12:38:43.909957 74:27:ea:0a:ef:47 > 33:33:00:00:00:16, ethertype IPv6 (0x86dd), length 90: fe80::554f:dc1d:5eed:c5d4 > ff02::16: HBH ICMP6, multicast listener report v2, 1 group record(s), length 28
12:38:43.958021 d8:24:bd:91:5d:40 > 00:15:17:fd:29:bc, ethertype IPv4 (0x0800), length 125: 172.22.1.1.55463 > 172.31.1.206.389: Flags [P.], seq 3179786172:3179786231, ack 1654172763, win 1018, options [nop,nop,TS val 868507202 ecr 1630116293], length 59
12:38:44.072314 d8:24:bd:91:5d:40 > 60:36:dd:42:8d:2b, ethertype IPv4 (0x0800), length 60: 14.139.247.8.80 > 172.31.8.25.59070: Flags [.], ack 2, win 3348, length 0
12:38:44.079524 00:23:e9:f1:84:c3 > 00:23:e9:f1:ea:03, ethertype IPv4 (0x0800), length 66: 172.31.1.95.1029 > 172.31.1.94.32770: Flags [.], ack 2188738103, win 32768, options [nop,nop,TS val 3816837700 ecr 3809788845], length 0
12:38:44.083866 d8:24:bd:91:5d:40 > 44:39:c4:37:2c:ad, ethertype IPv4 (0x0800), length 146: 172.26.38.76.38888 > 172.31.4.205.22: Flags [P.], seq 2296976014:2296976094, ack 2537584396, win 11903, options [nop,nop,TS val 35660298 ecr 229000116], length 80
