15:04:11.945846 00:0c:29:3e:bd:10 > 00:50:56:e9:db:34, ethertype IPv4 (0x0800), length 54: 192.168.88.141.41770 > 216.58.197.78.80: Flags [.], ack 1891591121, win 33570, length 0
15:04:11.946843 00:50:56:e9:db:34 > 00:0c:29:3e:bd:10, ethertype IPv4 (0x0800), length 60: 216.58.197.78.80 > 192.168.88.141.41770: Flags [.], ack 1, win 64240, length 0
15:04:12.103026 00:0c:29:3e:bd:10 > 00:50:56:e9:db:34, ethertype IPv4 (0x0800), length 100: 192.168.88.141.39152 > 157.240.189.82.443: Flags [P.], seq 822306336:822306382, ack 881650144, win 64860, length 46
15:04:12.103426 00:50:56:e9:db:34 > 00:0c:29:3e:bd:10, ethertype IPv4 (0x0800), length 60: 157.240.189.82.443 > 192.168.88.141.39152: Flags [.], ack 46, win 64240, length 0
15:04:12.184279 00:50:56:e9:db:34 > 00:0c:29:3e:bd:10, ethertype IPv4 (0x0800), length 100: 157.240.189.82.443 > 192.168.88.141.39152: Flags [P.], seq 1:47, ack 46, win 64240, length 46
15:04:12.184316 00:0c:29:3e:bd:10 > 00:50:56:e9:db:34, ethertype IPv4 (0x0800), length 54: 192.168.88.141.39152 > 157.240.189.82.443: Flags [.], ack 47, win 64860, length 0
15:04:17.104544 00:0c:29:3e:bd:10 > 00:50:56:e9:db:34, ethertype IPv4 (0x0800), length 54: 192.168.88.141.41770 > 216.58.197.78.80: Flags [F.], seq 1, ack 1, win 33570, length 0
15:04:17.105191 00:50:56:e9:db:34 > 00:0c:29:3e:bd:10, ethertype IPv4 (0x0800), length 60: 216.58.197.78.80 > 192.168.88.141.41770: Flags [.], ack 2, win 64239, length 0
15:04:17.107062 00:50:56:e9:db:34 > 00:0c:29:3e:bd:10, ethertype IPv4 (0x0800), length 60: 216.58.197.78.80 > 192.168.88.141.41770: Flags [FP.], seq 1, ack 2, win 64239, length 0
15:04:17.107165 00:0c:29:3e:bd:10 > 00:50:56:e9:db:34, ethertype IPv4 (0x0800), length 54: 192.168.88.141.41770 > 216.58.197.78.80: Flags [.], ack 2, win 33570, length 0
15:04:18.106350 00:0c:29:3e:bd:10 > 00:50:56:e9:db:34, ethertype IPv4 (0x0800), length 100: 192.168.88.141.38853 > 31.13.79.251.443: Flags [P.], seq 1205373617:1205373663, ack 1924290431, win 65535, length 46
15:04:18.107030 00:50:56:e9:db:34 > 00:0c:29:3e:bd:10, ethertype IPv4 (0x0800), length 60: 31.13.79.251.443 > 192.168.88.141.38853: Flags [.], ack 46, win 64240, length 0
15:04:18.323279 00:50:56:e9:db:34 > 00:0c:29:3e:bd:10, ethertype IPv4 (0x0800), length 100: 31.13.79.251.443 > 192.168.88.141.38853: Flags [P.], seq 1:47, ack 46, win 64240, length 46
15:04:18.323308 00:0c:29:3e:bd:10 > 00:50:56:e9:db:34, ethertype IPv4 (0x0800), length 54: 192.168.88.141.38853 > 31.13.79.251.443: Flags [.], ack 47, win 65535, length 0
15:04:19.107000 00:0c:29:3e:bd:10 > 00:50:56:e9:db:34, ethertype IPv4 (0x0800), length 95: 192.168.88.141.58757 > 216.58.197.66.443: Flags [P.], seq 488784409:488784450, ack 1159433879, win 42340, length 41
15:04:19.107356 00:0c:29:3e:bd:10 > 00:50:56:e9:db:34, ethertype IPv4 (0x0800), length 95: 192.168.88.141.55998 > 216.58.220.46.443: Flags [P.], seq 1483011198:1483011239, ack 434870458, win 48180, length 41
15:04:19.107464 00:50:56:e9:db:34 > 00:0c:29:3e:bd:10, ethertype IPv4 (0x0800), length 60: 216.58.197.66.443 > 192.168.88.141.58757: Flags [.], ack 41, win 64240, length 0
15:04:19.107574 00:0c:29:3e:bd:10 > 00:50:56:e9:db:34, ethertype IPv4 (0x0800), length 100: 192.168.88.141.47940 > 31.13.79.220.443: Flags [P.], seq 3617057626:3617057672, ack 292347660, win 64860, length 46
15:04:19.107715 00:50:56:e9:db:34 > 00:0c:29:3e:bd:10, ethertype IPv4 (0x0800), length 60: 216.58.220.46.443 > 192.168.88.141.55998: Flags [.], ack 41, win 64240, length 0
15:04:19.107855 00:0c:29:3e:bd:10 > 00:50:56:e9:db:34, ethertype IPv4 (0x0800), length 100: 192.168.88.141.44658 > 157.240.189.81.443: Flags [P.], seq 2766988154:2766988200, ack 957078781, win 65535, length 46
15:04:19.107956 00:50:56:e9:db:34 > 00:0c:29:3e:bd:10, ethertype IPv4 (0x0800), length 60: 31.13.79.220.443 > 192.168.88.141.47940: Flags [.], ack 46, win 64240, length 0
15:04:19.108154 00:50:56:e9:db:34 > 00:0c:29:3e:bd:10, ethertype IPv4 (0x0800), length 60: 157.240.189.81.443 > 192.168.88.141.44658: Flags [.], ack 46, win 64240, length 0
15:04:19.198637 00:50:56:e9:db:34 > 00:0c:29:3e:bd:10, ethertype IPv4 (0x0800), length 100: 157.240.189.81.443 > 192.168.88.141.44658: Flags [P.], seq 1:47, ack 46, win 64240, length 46
15:04:19.198677 00:0c:29:3e:bd:10 > 00:50:56:e9:db:34, ethertype IPv4 (0x0800), length 54: 192.168.88.141.44658 > 157.240.189.81.443: Flags [.], ack 47, win 65535, length 0
15:04:19.236952 00:50:56:e9:db:34 > 00:0c:29:3e:bd:10, ethertype IPv4 (0x0800), length 95: 216.58.197.66.443 > 192.168.88.141.58757: Flags [P.], seq 1:42, ack 41, win 64240, length 41
15:04:19.237048 00:0c:29:3e:bd:10 > 00:50:56:e9:db:34, ethertype IPv4 (0x0800), length 54: 192.168.88.141.58757 > 216.58.197.66.443: Flags [.], ack 42, win 42340, length 0
15:04:19.257048 00:50:56:e9:db:34 > 00:0c:29:3e:bd:10, ethertype IPv4 (0x0800), length 119: 216.58.220.46.443 > 192.168.88.141.55998: Flags [P.], seq 1:66, ack 41, win 64240, length 65
15:04:19.257099 00:0c:29:3e:bd:10 > 00:50:56:e9:db:34, ethertype IPv4 (0x0800), length 54: 192.168.88.141.55998 > 216.58.220.46.443: Flags [.], ack 66, win 48180, length 0
15:04:19.257235 00:50:56:e9:db:34 > 00:0c:29:3e:bd:10, ethertype IPv4 (0x0800), length 99: 216.58.220.46.443 > 192.168.88.141.55998: Flags [P.], seq 66:111, ack 41, win 64240, length 45
15:04:19.257254 00:0c:29:3e:bd:10 > 00:50:56:e9:db:34, ethertype IPv4 (0x0800), length 54: 192.168.88.141.55998 > 216.58.220.46.443: Flags [.], ack 111, win 48180, length 0
15:04:19.257330 00:50:56:e9:db:34 > 00:0c:29:3e:bd:10, ethertype IPv4 (0x0800), length 60: 216.58.220.46.443 > 192.168.88.141.55998: Flags [FP.], seq 111, ack 41, win 64240, length 0
15:04:19.257632 00:0c:29:3e:bd:10 > 00:50:56:e9:db:34, ethertype IPv4 (0x0800), length 99: 192.168.88.141.55998 > 216.58.220.46.443: Flags [P.], seq 41:86, ack 112, win 48180, length 45
15:04:19.258106 00:50:56:e9:db:34 > 00:0c:29:3e:bd:10, ethertype IPv4 (0x0800), length 60: 216.58.220.46.443 > 192.168.88.141.55998: Flags [.], ack 86, win 64240, length 0
15:04:19.258413 00:0c:29:3e:bd:10 > 00:50:56:e9:db:34, ethertype IPv4 (0x0800), length 85: 192.168.88.141.55998 > 216.58.220.46.443: Flags [P.], seq 86:117, ack 112, win 48180, length 31
15:04:19.258570 00:0c:29:3e:bd:10 > 00:50:56:e9:db:34, ethertype IPv4 (0x0800), length 54: 192.168.88.141.55998 > 216.58.220.46.443: Flags [F.], seq 117, ack 112, win 48180, length 0
15:04:19.258688 00:50:56:e9:db:34 > 00:0c:29:3e:bd:10, ethertype IPv4 (0x0800), length 60: 216.58.220.46.443 > 192.168.88.141.55998: Flags [.], ack 117, win 64240, length 0
15:04:19.259115 00:50:56:e9:db:34 > 00:0c:29:3e:bd:10, ethertype IPv4 (0x0800), length 60: 216.58.220.46.443 > 192.168.88.141.55998: Flags [.], ack 118, win 64239, length 0
15:04:19.291001 00:50:56:e9:db:34 > 00:0c:29:3e:bd:10, ethertype IPv4 (0x0800), length 100: 31.13.79.220.443 > 192.168.88.141.47940: Flags [P.], seq 1:47, ack 46, win 64240, length 46
15:04:19.291047 00:0c:29:3e:bd:10 > 00:50:56:e9:db:34, ethertype IPv4 (0x0800), length 54: 192.168.88.141.47940 > 31.13.79.220.443: Flags [.], ack 47, win 64860, length 0
15:04:19.778977 00:0c:29:3e:bd:10 > 00:50:56:e9:db:34, ethertype IPv4 (0x0800), length 76: 192.168.88.141.58416 > 192.168.88.2.53: 13403+ A? www.facebook.com. (34)
15:04:19.779289 00:0c:29:3e:bd:10 > 00:50:56:e9:db:34, ethertype IPv4 (0x0800), length 76: 192.168.88.141.53249 > 192.168.88.2.53: 63084+ AAAA? www.facebook.com. (34)
15:04:19.780485 00:0c:29:3e:bd:10 > 00:50:56:e9:db:34, ethertype IPv4 (0x0800), length 548: 192.168.88.141.47940 > 31.13.79.220.443: Flags [P.], seq 46:540, ack 47, win 64860, length 494
15:04:19.780726 00:0c:29:3e:bd:10 > 00:50:56:e9:db:34, ethertype IPv4 (0x0800), length 411: 192.168.88.141.47940 > 31.13.79.220.443: Flags [P.], seq 540:897, ack 47, win 64860, length 357
15:04:19.780864 00:50:56:e9:db:34 > 00:0c:29:3e:bd:10, ethertype IPv4 (0x0800), length 60: 31.13.79.220.443 > 192.168.88.141.47940: Flags [.], ack 540, win 64240, length 0
15:04:19.780973 00:50:56:e9:db:34 > 00:0c:29:3e:bd:10, ethertype IPv4 (0x0800), length 60: 31.13.79.220.443 > 192.168.88.141.47940: Flags [.], ack 897, win 64240, length 0
15:04:19.782373 00:50:56:e9:db:34 > 00:0c:29:3e:bd:10, ethertype IPv4 (0x0800), length 244: 192.168.88.2.53 > 192.168.88.141.58416: 13403 2/2/4 CNAME star-mini.c10r.facebook.com., A 31.13.79.220 (202)
15:04:19.787691 00:50:56:e9:db:34 > 00:0c:29:3e:bd:10, ethertype IPv4 (0x0800), length 256: 192.168.88.2.53 > 192.168.88.141.53249: 63084 2/2/4 CNAME star-mini.c10r.facebook.com., AAAA 2a03:2880:f00c:1e:face:b00c:0:25de (214)
15:04:19.949767 00:50:56:e9:db:34 > 00:0c:29:3e:bd:10, ethertype IPv4 (0x0800), length 96: 31.13.79.220.443 > 192.168.88.141.47940: Flags [P.], seq 47:89, ack 897, win 64240, length 42
15:04:19.949805 00:0c:29:3e:bd:10 > 00:50:56:e9:db:34, ethertype IPv4 (0x0800), length 54: 192.168.88.141.47940 > 31.13.79.220.443: Flags [.], ack 89, win 64860, length 0
15:04:20.108305 00:0c:29:3e:bd:10 > 00:50:56:e9:db:34, ethertype IPv4 (0x0800), length 95: 192.168.88.141.54717 > 216.58.197.67.443: Flags [P.], seq 620264541:620264582, ack 377857148, win 65535, length 41
15:04:20.108698 00:0c:29:3e:bd:10 > 00:50:56:e9:db:34, ethertype IPv4 (0x0800), length 95: 192.168.88.141.45922 > 31.13.79.244.443: Flags [P.], seq 2185063895:2185063936, ack 109657543, win 43800, length 41
15:04:20.108857 00:50:56:e9:db:34 > 00:0c:29:3e:bd:10, ethertype IPv4 (0x0800), length 60: 216.58.197.67.443 > 192.168.88.141.54717: Flags [.], ack 41, win 64240, length 0
15:04:20.109007 00:0c:29:3e:bd:10 > 00:50:56:e9:db:34, ethertype IPv4 (0x0800), length 95: 192.168.88.141.51285 > 216.58.197.68.443: Flags [P.], seq 1806991039:1806991080, ack 1094725651, win 43800, length 41
15:04:20.109144 00:50:56:e9:db:34 > 00:0c:29:3e:bd:10, ethertype IPv4 (0x0800), length 60: 31.13.79.244.443 > 192.168.88.141.45922: Flags [.], ack 41, win 64240, length 0
15:04:20.109229 00:0c:29:3e:bd:10 > 00:50:56:e9:db:34, ethertype IPv4 (0x0800), length 95: 192.168.88.141.35154 > 31.13.79.242.443: Flags [P.], seq 3006664366:3006664407, ack 1527941766, win 42300, length 41
15:04:20.109332 00:50:56:e9:db:34 > 00:0c:29:3e:bd:10, ethertype IPv4 (0x0800), length 60: 216.58.197.68.443 > 192.168.88.141.51285: Flags [.], ack 41, win 64240, length 0
15:04:20.109555 00:50:56:e9:db:34 > 00:0c:29:3e:bd:10, ethertype IPv4 (0x0800), length 60: 31.13.79.242.443 > 192.168.88.141.35154: Flags [.], ack 41, win 64240, length 0
15:04:20.215696 00:50:56:e9:db:34 > 00:0c:29:3e:bd:10, ethertype IPv4 (0x0800), length 95: 216.58.197.67.443 > 192.168.88.141.54717: Flags [P.], seq 1:42, ack 41, win 64240, length 41
15:04:20.215743 00:0c:29:3e:bd:10 > 00:50:56:e9:db:34, ethertype IPv4 (0x0800), length 54: 192.168.88.141.54717 > 216.58.197.67.443: Flags [.], ack 42, win 65535, length 0
15:04:20.250577 00:50:56:e9:db:34 > 00:0c:29:3e:bd:10, ethertype IPv4 (0x0800), length 95: 31.13.79.244.443 > 192.168.88.141.45922: Flags [P.], seq 1:42, ack 41, win 64240, length 41
15:04:20.250622 00:0c:29:3e:bd:10 > 00:50:56:e9:db:34, ethertype IPv4 (0x0800), length 54: 192.168.88.141.45922 > 31.13.79.244.443: Flags [.], ack 42, win 43800, length 0
15:04:20.256278 00:50:56:e9:db:34 > 00:0c:29:3e:bd:10, ethertype IPv4 (0x0800), length 95: 31.13.79.242.443 > 192.168.88.141.35154: Flags [P.], seq 1:42, ack 41, win 64240, length 41
15:04:20.256318 00:0c:29:3e:bd:10 > 00:50:56:e9:db:34, ethertype IPv4 (0x0800), length 54: 192.168.88.141.35154 > 31.13.79.242.443: Flags [.], ack 42, win 42300, length 0
15:04:20.258008 00:50:56:e9:db:34 > 00:0c:29:3e:bd:10, ethertype IPv4 (0x0800), length 95: 216.58.197.68.443 > 192.168.88.141.51285: Flags [P.], seq 1:42, ack 41, win 64240, length 41
15:04:20.258042 00:0c:29:3e:bd:10 > 00:50:56:e9:db:34, ethertype IPv4 (0x0800), length 54: 192.168.88.141.51285 > 216.58.197.68.443: Flags [.], ack 42, win 43800, length 0
15:04:20.416306 00:50:56:e9:db:34 > 00:0c:29:3e:bd:10, ethertype IPv4 (0x0800), length 3308: 31.13.79.220.443 > 192.168.88.141.47940: Flags [P.], seq 89:3343, ack 897, win 64240, length 3254
15:04:20.416350 00:0c:29:3e:bd:10 > 00:50:56:e9:db:34, ethertype IPv4 (0x0800), length 54: 192.168.88.141.47940 > 31.13.79.220.443: Flags [.], ack 3343, win 64860, length 0
15:04:20.419513 00:50:56:e9:db:34 > 00:0c:29:3e:bd:10, ethertype IPv4 (0x0800), length 102: 31.13.79.220.443 > 192.168.88.141.47940: Flags [P.], seq 3343:3391, ack 897, win 64240, length 48
15:04:20.419622 00:0c:29:3e:bd:10 > 00:50:56:e9:db:34, ethertype IPv4 (0x0800), length 54: 192.168.88.141.47940 > 31.13.79.220.443: Flags [.], ack 3391, win 64860, length 0
15:04:20.442674 00:0c:29:3e:bd:10 > 00:50:56:e9:db:34, ethertype IPv4 (0x0800), length 90: 192.168.88.141.47310 > 192.168.88.2.53: 37400+ A? external.fdel1-2.fna.fbcdn.net. (48)
15:04:20.442982 00:0c:29:3e:bd:10 > 00:50:56:e9:db:34, ethertype IPv4 (0x0800), length 90: 192.168.88.141.30879 > 192.168.88.2.53: 5795+ AAAA? external.fdel1-2.fna.fbcdn.net. (48)
15:04:20.445048 00:50:56:e9:db:34 > 00:0c:29:3e:bd:10, ethertype IPv4 (0x0800), length 164: 192.168.88.2.53 > 192.168.88.141.47310: 37400 2/2/0 CNAME scontent.fdel1-2.fna.fbcdn.net., A 157.240.189.81 (122)
15:04:20.446335 00:50:56:e9:db:34 > 00:0c:29:3e:bd:10, ethertype IPv4 (0x0800), length 165: 192.168.88.2.53 > 192.168.88.141.30879: 5795 1/1/0 CNAME scontent.fdel1-2.fna.fbcdn.net. (123)
15:04:20.462244 00:0c:29:3e:bd:10 > 00:50:56:e9:db:34, ethertype IPv4 (0x0800), length 244: 192.168.88.141.44658 > 157.240.189.81.443: Flags [P.], seq 46:236, ack 47, win 65535, length 190
15:04:20.463249 00:50:56:e9:db:34 > 00:0c:29:3e:bd:10, ethertype IPv4 (0x0800), length 60: 157.240.189.81.443 > 192.168.88.141.44658: Flags [.], ack 236, win 64240, length 0
15:04:20.548928 00:50:56:e9:db:34 > 00:0c:29:3e:bd:10, ethertype IPv4 (0x0800), length 1506: 157.240.189.81.443 > 192.168.88.141.44658: Flags [P.], seq 47:1499, ack 236, win 64240, length 1452
15:04:20.549018 00:0c:29:3e:bd:10 > 00:50:56:e9:db:34, ethertype IPv4 (0x0800), length 54: 192.168.88.141.44658 > 157.240.189.81.443: Flags [.], ack 1499, win 65535, length 0
15:04:20.549587 00:50:56:e9:db:34 > 00:0c:29:3e:bd:10, ethertype IPv4 (0x0800), length 2324: 157.240.189.81.443 > 192.168.88.141.44658: Flags [P.], seq 1499:3769, ack 236, win 64240, length 2270
15:04:20.549628 00:0c:29:3e:bd:10 > 00:50:56:e9:db:34, ethertype IPv4 (0x0800), length 54: 192.168.88.141.44658 > 157.240.189.81.443: Flags [.], ack 3769, win 65535, length 0
15:04:22.110408 00:0c:29:3e:bd:10 > 00:50:56:e9:db:34, ethertype IPv4 (0x0800), length 100: 192.168.88.141.38852 > 31.13.79.251.443: Flags [P.], seq 2421866822:2421866868, ack 53253097, win 65535, length 46
15:04:22.110801 00:50:56:e9:db:34 > 00:0c:29:3e:bd:10, ethertype IPv4 (0x0800), length 60: 31.13.79.251.443 > 192.168.88.141.38852: Flags [.], ack 46, win 64240, length 0
15:04:22.282894 00:50:56:e9:db:34 > 00:0c:29:3e:bd:10, ethertype IPv4 (0x0800), length 100: 31.13.79.251.443 > 192.168.88.141.38852: Flags [P.], seq 1:47, ack 46, win 64240, length 46
15:04:22.282945 00:0c:29:3e:bd:10 > 00:50:56:e9:db:34, ethertype IPv4 (0x0800), length 54: 192.168.88.141.38852 > 31.13.79.251.443: Flags [.], ack 47, win 65535, length 0
15:04:54.111618 00:0c:29:3e:bd:10 > 00:50:56:e9:db:34, ethertype IPv4 (0x0800), length 95: 192.168.88.141.34421 > 216.58.197.78.443: Flags [P.], seq 3847569221:3847569262, ack 902780874, win 65535, length 41
15:04:54.112403 00:50:56:e9:db:34 > 00:0c:29:3e:bd:10, ethertype IPv4 (0x0800), length 60: 216.58.197.78.443 > 192.168.88.141.34421: Flags [.], ack 41, win 64240, length 0
15:04:54.280520 00:50:56:e9:db:34 > 00:0c:29:3e:bd:10, ethertype IPv4 (0x0800), length 164: 216.58.197.78.443 > 192.168.88.141.34421: Flags [P.], seq 1:111, ack 41, win 64240, length 110
15:04:54.280548 00:0c:29:3e:bd:10 > 00:50:56:e9:db:34, ethertype IPv4 (0x0800), length 54: 192.168.88.141.34421 > 216.58.197.78.443: Flags [.], ack 111, win 65535, length 0
15:04:54.280601 00:50:56:e9:db:34 > 00:0c:29:3e:bd:10, ethertype IPv4 (0x0800), length 60: 216.58.197.78.443 > 192.168.88.141.34421: Flags [FP.], seq 111, ack 41, win 64240, length 0
15:04:54.280963 00:0c:29:3e:bd:10 > 00:50:56:e9:db:34, ethertype IPv4 (0x0800), length 99: 192.168.88.141.34421 > 216.58.197.78.443: Flags [P.], seq 41:86, ack 112, win 65535, length 45
15:04:54.281406 00:50:56:e9:db:34 > 00:0c:29:3e:bd:10, ethertype IPv4 (0x0800), length 60: 216.58.197.78.443 > 192.168.88.141.34421: Flags [.], ack 86, win 64240, length 0
15:04:54.282162 00:0c:29:3e:bd:10 > 00:50:56:e9:db:34, ethertype IPv4 (0x0800), length 85: 192.168.88.141.34421 > 216.58.197.78.443: Flags [P.], seq 86:117, ack 112, win 65535, length 31
15:04:54.282478 00:50:56:e9:db:34 > 00:0c:29:3e:bd:10, ethertype IPv4 (0x0800), length 60: 216.58.197.78.443 > 192.168.88.141.34421: Flags [.], ack 117, win 64240, length 0
15:04:54.283643 00:0c:29:3e:bd:10 > 00:50:56:e9:db:34, ethertype IPv4 (0x0800), length 54: 192.168.88.141.34421 > 216.58.197.78.443: Flags [F.], seq 117, ack 112, win 65535, length 0
15:04:54.284021 00:50:56:e9:db:34 > 00:0c:29:3e:bd:10, ethertype IPv4 (0x0800), length 60: 216.58.197.78.443 > 192.168.88.141.34421: Flags [.], ack 118, win 64239, length 0
15:04:59.279012 00:50:56:e9:db:34 > 00:0c:29:3e:bd:10, ethertype IPv4 (0x0800), length 165: 31.13.79.246.443 > 192.168.88.141.53340: Flags [P.], seq 399018463:399018574, ack 876087545, win 64240, length 111
15:04:59.279039 00:0c:29:3e:bd:10 > 00:50:56:e9:db:34, ethertype IPv4 (0x0800), length 54: 192.168.88.141.53340 > 31.13.79.246.443: Flags [.], ack 111, win 43800, length 0
15:04:59.300721 00:0c:29:3e:bd:10 > 00:50:56:e9:db:34, ethertype IPv4 (0x0800), length 669: 192.168.88.141.53340 > 31.13.79.246.443: Flags [P.], seq 1:616, ack 111, win 43800, length 615
15:04:59.301888 00:50:56:e9:db:34 > 00:0c:29:3e:bd:10, ethertype IPv4 (0x0800), length 60: 31.13.79.246.443 > 192.168.88.141.53340: Flags [.], ack 616, win 64240, length 0
15:04:59.478485 00:50:56:e9:db:34 > 00:0c:29:3e:bd:10, ethertype IPv4 (0x0800), length 96: 31.13.79.246.443 > 192.168.88.141.53340: Flags [P.], seq 111:153, ack 616, win 64240, length 42
15:04:59.517990 00:0c:29:3e:bd:10 > 00:50:56:e9:db:34, ethertype IPv4 (0x0800), length 54: 192.168.88.141.53340 > 31.13.79.246.443: Flags [.], ack 153, win 43800, length 0
15:05:11.112725 00:0c:29:3e:bd:10 > 00:50:56:e9:db:34, ethertype IPv4 (0x0800), length 100: 192.168.88.141.39152 > 157.240.189.82.443: Flags [P.], seq 46:92, ack 47, win 64860, length 46
15:05:11.113563 00:50:56:e9:db:34 > 00:0c:29:3e:bd:10, ethertype IPv4 (0x0800), length 60: 157.240.189.82.443 > 192.168.88.141.39152: Flags [.], ack 92, win 64240, length 0
15:05:11.240319 00:50:56:e9:db:34 > 00:0c:29:3e:bd:10, ethertype IPv4 (0x0800), length 100: 157.240.189.82.443 > 192.168.88.141.39152: Flags [P.], seq 47:93, ack 92, win 64240, length 46
15:05:11.240359 00:0c:29:3e:bd:10 > 00:50:56:e9:db:34, ethertype IPv4 (0x0800), length 54: 192.168.88.141.39152 > 157.240.189.82.443: Flags [.], ack 93, win 64860, length 0
15:05:15.109293 00:0c:29:3e:bd:10 > 00:50:56:e9:db:34, ethertype IPv4 (0x0800), length 100: 192.168.88.141.39152 > 157.240.189.82.443: Flags [P.], seq 92:138, ack 93, win 64860, length 46
15:05:15.110166 00:50:56:e9:db:34 > 00:0c:29:3e:bd:10, ethertype IPv4 (0x0800), length 60: 157.240.189.82.443 > 192.168.88.141.39152: Flags [.], ack 138, win 64240, length 0
15:05:15.121976 00:0c:29:3e:bd:10 > 00:50:56:e9:db:34, ethertype IPv4 (0x0800), length 85: 192.168.88.141.39152 > 157.240.189.82.443: Flags [P.], seq 138:169, ack 93, win 64860, length 31
15:05:15.122097 00:0c:29:3e:bd:10 > 00:50:56:e9:db:34, ethertype IPv4 (0x0800), length 54: 192.168.88.141.39152 > 157.240.189.82.443: Flags [F.], seq 169, ack 93, win 64860, length 0
15:05:15.122169 00:50:56:e9:db:34 > 00:0c:29:3e:bd:10, ethertype IPv4 (0x0800), length 60: 157.240.189.82.443 > 192.168.88.141.39152: Flags [.], ack 169, win 64240, length 0
15:05:15.122319 00:50:56:e9:db:34 > 00:0c:29:3e:bd:10, ethertype IPv4 (0x0800), length 60: 157.240.189.82.443 > 192.168.88.141.39152: Flags [.], ack 170, win 64239, length 0
15:05:15.202761 00:50:56:e9:db:34 > 00:0c:29:3e:bd:10, ethertype IPv4 (0x0800), length 100: 157.240.189.82.443 > 192.168.88.141.39152: Flags [P.], seq 93:139, ack 170, win 64239, length 46
15:05:15.202797 00:0c:29:3e:bd:10 > 00:50:56:e9:db:34, ethertype IPv4 (0x0800), length 54: 192.168.88.141.39152 > 157.240.189.82.443: Flags [R], seq 822306506, win 0, length 0
15:05:17.117124 00:0c:29:3e:bd:10 > 00:50:56:e9:db:34, ethertype IPv4 (0x0800), length 100: 192.168.88.141.38853 > 31.13.79.251.443: Flags [P.], seq 46:92, ack 47, win 65535, length 46
15:05:17.117384 00:50:56:e9:db:34 > 00:0c:29:3e:bd:10, ethertype IPv4 (0x0800), length 60: 31.13.79.251.443 > 192.168.88.141.38853: Flags [.], ack 92, win 64240, length 0
15:05:17.332134 00:50:56:e9:db:34 > 00:0c:29:3e:bd:10, ethertype IPv4 (0x0800), length 100: 31.13.79.251.443 > 192.168.88.141.38853: Flags [P.], seq 47:93, ack 92, win 64240, length 46
15:05:17.332157 00:0c:29:3e:bd:10 > 00:50:56:e9:db:34, ethertype IPv4 (0x0800), length 54: 192.168.88.141.38853 > 31.13.79.251.443: Flags [.], ack 93, win 65535, length 0
15:05:18.118745 00:0c:29:3e:bd:10 > 00:50:56:e9:db:34, ethertype IPv4 (0x0800), length 95: 192.168.88.141.58757 > 216.58.197.66.443: Flags [P.], seq 41:82, ack 42, win 42340, length 41
15:05:18.118981 00:50:56:e9:db:34 > 00:0c:29:3e:bd:10, ethertype IPv4 (0x0800), length 60: 216.58.197.66.443 > 192.168.88.141.58757: Flags [.], ack 82, win 64240, length 0
15:05:18.278115 00:50:56:e9:db:34 > 00:0c:29:3e:bd:10, ethertype IPv4 (0x0800), length 119: 216.58.197.66.443 > 192.168.88.141.58757: Flags [P.], seq 42:107, ack 82, win 64240, length 65
15:05:18.278140 00:0c:29:3e:bd:10 > 00:50:56:e9:db:34, ethertype IPv4 (0x0800), length 54: 192.168.88.141.58757 > 216.58.197.66.443: Flags [.], ack 107, win 42340, length 0
15:05:18.280041 00:50:56:e9:db:34 > 00:0c:29:3e:bd:10, ethertype IPv4 (0x0800), length 99: 216.58.197.66.443 > 192.168.88.141.58757: Flags [P.], seq 107:152, ack 82, win 64240, length 45
15:05:18.280061 00:0c:29:3e:bd:10 > 00:50:56:e9:db:34, ethertype IPv4 (0x0800), length 54: 192.168.88.141.58757 > 216.58.197.66.443: Flags [.], ack 152, win 42340, length 0
15:05:18.280222 00:0c:29:3e:bd:10 > 00:50:56:e9:db:34, ethertype IPv4 (0x0800), length 99: 192.168.88.141.58757 > 216.58.197.66.443: Flags [P.], seq 82:127, ack 152, win 42340, length 45
15:05:18.280669 00:50:56:e9:db:34 > 00:0c:29:3e:bd:10, ethertype IPv4 (0x0800), length 60: 216.58.197.66.443 > 192.168.88.141.58757: Flags [.], ack 127, win 64240, length 0
15:05:18.280830 00:50:56:e9:db:34 > 00:0c:29:3e:bd:10, ethertype IPv4 (0x0800), length 60: 216.58.197.66.443 > 192.168.88.141.58757: Flags [FP.], seq 152, ack 127, win 64240, length 0
15:05:18.281110 00:0c:29:3e:bd:10 > 00:50:56:e9:db:34, ethertype IPv4 (0x0800), length 85: 192.168.88.141.58757 > 216.58.197.66.443: Flags [P.], seq 127:158, ack 153, win 42340, length 31
15:05:18.281239 00:0c:29:3e:bd:10 > 00:50:56:e9:db:34, ethertype IPv4 (0x0800), length 54: 192.168.88.141.58757 > 216.58.197.66.443: Flags [F.], seq 158, ack 153, win 42340, length 0
15:05:18.281292 00:50:56:e9:db:34 > 00:0c:29:3e:bd:10, ethertype IPv4 (0x0800), length 60: 216.58.197.66.443 > 192.168.88.141.58757: Flags [.], ack 158, win 64240, length 0
15:05:18.281773 00:50:56:e9:db:34 > 00:0c:29:3e:bd:10, ethertype IPv4 (0x0800), length 60: 216.58.197.66.443 > 192.168.88.141.58757: Flags [.], ack 159, win 64239, length 0
15:05:19.120139 00:0c:29:3e:bd:10 > 00:50:56:e9:db:34, ethertype IPv4 (0x0800), length 95: 192.168.88.141.54717 > 216.58.197.67.443: Flags [P.], seq 41:82, ack 42, win 65535, length 41
15:05:19.121221 00:50:56:e9:db:34 > 00:0c:29:3e:bd:10, ethertype IPv4 (0x0800), length 60: 216.58.197.67.443 > 192.168.88.141.54717: Flags [.], ack 82, win 64240, length 0
15:05:19.121339 00:0c:29:3e:bd:10 > 00:50:56:e9:db:34, ethertype IPv4 (0x0800), length 100: 192.168.88.141.47940 > 31.13.79.220.443: Flags [P.], seq 897:943, ack 3391, win 64860, length 46
15:05:19.121534 00:0c:29:3e:bd:10 > 00:50:56:e9:db:34, ethertype IPv4 (0x0800), length 95: 192.168.88.141.45922 > 31.13.79.244.443: Flags [P.], seq 41:82, ack 42, win 43800, length 41
15:05:19.121624 00:50:56:e9:db:34 > 00:0c:29:3e:bd:10, ethertype IPv4 (0x0800), length 60: 31.13.79.220.443 > 192.168.88.141.47940: Flags [.], ack 943, win 64240, length 0
15:05:19.121703 00:0c:29:3e:bd:10 > 00:50:56:e9:db:34, ethertype IPv4 (0x0800), length 95: 192.168.88.141.51285 > 216.58.197.68.443: Flags [P.], seq 41:82, ack 42, win 43800, length 41
15:05:19.121757 00:50:56:e9:db:34 > 00:0c:29:3e:bd:10, ethertype IPv4 (0x0800), length 60: 31.13.79.244.443 > 192.168.88.141.45922: Flags [.], ack 82, win 64240, length 0
15:05:19.121812 00:0c:29:3e:bd:10 > 00:50:56:e9:db:34, ethertype IPv4 (0x0800), length 100: 192.168.88.141.44658 > 157.240.189.81.443: Flags [P.], seq 236:282, ack 3769, win 65535, length 46
15:05:19.121873 00:50:56:e9:db:34 > 00:0c:29:3e:bd:10, ethertype IPv4 (0x0800), length 60: 216.58.197.68.443 > 192.168.88.141.51285: Flags [.], ack 82, win 64240, length 0
15:05:19.121922 00:0c:29:3e:bd:10 > 00:50:56:e9:db:34, ethertype IPv4 (0x0800), length 95: 192.168.88.141.35154 > 31.13.79.242.443: Flags [P.], seq 41:82, ack 42, win 42300, length 41
15:05:19.121971 00:50:56:e9:db:34 > 00:0c:29:3e:bd:10, ethertype IPv4 (0x0800), length 60: 157.240.189.81.443 > 192.168.88.141.44658: Flags [.], ack 282, win 64240, length 0
15:05:19.122075 00:50:56:e9:db:34 > 00:0c:29:3e:bd:10, ethertype IPv4 (0x0800), length 60: 31.13.79.242.443 > 192.168.88.141.35154: Flags [.], ack 82, win 64240, length 0
15:05:19.266202 00:50:56:e9:db:34 > 00:0c:29:3e:bd:10, ethertype IPv4 (0x0800), length 119: 216.58.197.67.443 > 192.168.88.141.54717: Flags [P.], seq 42:107, ack 82, win 64240, length 65
15:05:19.266226 00:0c:29:3e:bd:10 > 00:50:56:e9:db:34, ethertype IPv4 (0x0800), length 54: 192.168.88.141.54717 > 216.58.197.67.443: Flags [.], ack 107, win 65535, length 0
15:05:19.266269 00:50:56:e9:db:34 > 00:0c:29:3e:bd:10, ethertype IPv4 (0x0800), length 99: 216.58.197.67.443 > 192.168.88.141.54717: Flags [P.], seq 107:152, ack 82, win 64240, length 45
15:05:19.266277 00:0c:29:3e:bd:10 > 00:50:56:e9:db:34, ethertype IPv4 (0x0800), length 54: 192.168.88.141.54717 > 216.58.197.67.443: Flags [.], ack 152, win 65535, length 0
15:05:19.266436 00:50:56:e9:db:34 > 00:0c:29:3e:bd:10, ethertype IPv4 (0x0800), length 60: 216.58.197.67.443 > 192.168.88.141.54717: Flags [FP.], seq 152, ack 82, win 64240, length 0
15:05:19.266549 00:0c:29:3e:bd:10 > 00:50:56:e9:db:34, ethertype IPv4 (0x0800), length 99: 192.168.88.141.54717 > 216.58.197.67.443: Flags [P.], seq 82:127, ack 153, win 65535, length 45
15:05:19.266735 00:0c:29:3e:bd:10 > 00:50:56:e9:db:34, ethertype IPv4 (0x0800), length 85: 192.168.88.141.54717 > 216.58.197.67.443: Flags [P.], seq 127:158, ack 153, win 65535, length 31
15:05:19.266790 00:50:56:e9:db:34 > 00:0c:29:3e:bd:10, ethertype IPv4 (0x0800), length 60: 216.58.197.67.443 > 192.168.88.141.54717: Flags [.], ack 127, win 64240, length 0
15:05:19.266828 00:50:56:e9:db:34 > 00:0c:29:3e:bd:10, ethertype IPv4 (0x0800), length 60: 216.58.197.67.443 > 192.168.88.141.54717: Flags [.], ack 158, win 64240, length 0
15:05:19.266857 00:0c:29:3e:bd:10 > 00:50:56:e9:db:34, ethertype IPv4 (0x0800), length 54: 192.168.88.141.54717 > 216.58.197.67.443: Flags [F.], seq 158, ack 153, win 65535, length 0
15:05:19.267509 00:50:56:e9:db:34 > 00:0c:29:3e:bd:10, ethertype IPv4 (0x0800), length 60: 216.58.197.67.443 > 192.168.88.141.54717: Flags [.], ack 159, win 64239, length 0
15:05:19.292400 00:50:56:e9:db:34 > 00:0c:29:3e:bd:10, ethertype IPv4 (0x0800), length 100: 157.240.189.81.443 > 192.168.88.141.44658: Flags [P.], seq 3769:3815, ack 282, win 64240, length 46
15:05:19.292428 00:0c:29:3e:bd:10 > 00:50:56:e9:db:34, ethertype IPv4 (0x0800), length 54: 192.168.88.141.44658 > 157.240.189.81.443: Flags [.], ack 3815, win 65535, length 0
15:05:19.372645 00:50:56:e9:db:34 > 00:0c:29:3e:bd:10, ethertype IPv4 (0x0800), length 95: 31.13.79.244.443 > 192.168.88.141.45922: Flags [P.], seq 42:83, ack 82, win 64240, length 41
15:05:19.372672 00:0c:29:3e:bd:10 > 00:50:56:e9:db:34, ethertype IPv4 (0x0800), length 54: 192.168.88.141.45922 > 31.13.79.244.443: Flags [.], ack 83, win 43800, length 0
15:05:19.381736 00:50:56:e9:db:34 > 00:0c:29:3e:bd:10, ethertype IPv4 (0x0800), length 95: 31.13.79.242.443 > 192.168.88.141.35154: Flags [P.], seq 42:83, ack 82, win 64240, length 41
15:05:19.381761 00:0c:29:3e:bd:10 > 00:50:56:e9:db:34, ethertype IPv4 (0x0800), length 54: 192.168.88.141.35154 > 31.13.79.242.443: Flags [.], ack 83, win 42300, length 0
15:05:19.381803 00:50:56:e9:db:34 > 00:0c:29:3e:bd:10, ethertype IPv4 (0x0800), length 164: 216.58.197.68.443 > 192.168.88.141.51285: Flags [P.], seq 42:152, ack 82, win 64240, length 110
15:05:19.381812 00:0c:29:3e:bd:10 > 00:50:56:e9:db:34, ethertype IPv4 (0x0800), length 54: 192.168.88.141.51285 > 216.58.197.68.443: Flags [.], ack 152, win 43800, length 0
15:05:19.382049 00:0c:29:3e:bd:10 > 00:50:56:e9:db:34, ethertype IPv4 (0x0800), length 99: 192.168.88.141.51285 > 216.58.197.68.443: Flags [P.], seq 82:127, ack 152, win 43800, length 45
15:05:19.382116 00:50:56:e9:db:34 > 00:0c:29:3e:bd:10, ethertype IPv4 (0x0800), length 60: 216.58.197.68.443 > 192.168.88.141.51285: Flags [FP.], seq 152, ack 82, win 64240, length 0
15:05:19.382243 00:50:56:e9:db:34 > 00:0c:29:3e:bd:10, ethertype IPv4 (0x0800), length 60: 216.58.197.68.443 > 192.168.88.141.51285: Flags [.], ack 127, win 64240, length 0
15:05:19.382423 00:0c:29:3e:bd:10 > 00:50:56:e9:db:34, ethertype IPv4 (0x0800), length 85: 192.168.88.141.51285 > 216.58.197.68.443: Flags [P.], seq 127:158, ack 153, win 43800, length 31
15:05:19.382490 00:0c:29:3e:bd:10 > 00:50:56:e9:db:34, ethertype IPv4 (0x0800), length 54: 192.168.88.141.51285 > 216.58.197.68.443: Flags [F.], seq 158, ack 153, win 43800, length 0
15:05:19.382541 00:50:56:e9:db:34 > 00:0c:29:3e:bd:10, ethertype IPv4 (0x0800), length 60: 216.58.197.68.443 > 192.168.88.141.51285: Flags [.], ack 158, win 64240, length 0
15:05:19.382604 00:50:56:e9:db:34 > 00:0c:29:3e:bd:10, ethertype IPv4 (0x0800), length 60: 216.58.197.68.443 > 192.168.88.141.51285: Flags [.], ack 159, win 64239, length 0
15:05:19.407883 00:50:56:e9:db:34 > 00:0c:29:3e:bd:10, ethertype IPv4 (0x0800), length 100: 31.13.79.220.443 > 192.168.88.141.47940: Flags [P.], seq 3391:3437, ack 943, win 64240, length 46
15:05:19.407912 00:0c:29:3e:bd:10 > 00:50:56:e9:db:34, ethertype IPv4 (0x0800), length 54: 192.168.88.141.47940 > 31.13.79.220.443: Flags [.], ack 3437, win 64860, length 0
15:05:19.768259 00:0c:29:3e:bd:10 > 00:50:56:e9:db:34, ethertype IPv4 (0x0800), length 76: 192.168.88.141.10221 > 192.168.88.2.53: 23958+ A? www.facebook.com. (34)
15:05:19.768430 00:0c:29:3e:bd:10 > 00:50:56:e9:db:34, ethertype IPv4 (0x0800), length 76: 192.168.88.141.31266 > 192.168.88.2.53: 14994+ AAAA? www.facebook.com. (34)
15:05:19.768953 00:0c:29:3e:bd:10 > 00:50:56:e9:db:34, ethertype IPv4 (0x0800), length 548: 192.168.88.141.47940 > 31.13.79.220.443: Flags [P.], seq 943:1437, ack 3437, win 64860, length 494
15:05:19.769076 00:0c:29:3e:bd:10 > 00:50:56:e9:db:34, ethertype IPv4 (0x0800), length 411: 192.168.88.141.47940 > 31.13.79.220.443: Flags [P.], seq 1437:1794, ack 3437, win 64860, length 357
15:05:19.769186 00:50:56:e9:db:34 > 00:0c:29:3e:bd:10, ethertype IPv4 (0x0800), length 60: 31.13.79.220.443 > 192.168.88.141.47940: Flags [.], ack 1437, win 64240, length 0
15:05:19.769192 00:50:56:e9:db:34 > 00:0c:29:3e:bd:10, ethertype IPv4 (0x0800), length 60: 31.13.79.220.443 > 192.168.88.141.47940: Flags [.], ack 1794, win 64240, length 0
15:05:19.813852 00:50:56:e9:db:34 > 00:0c:29:3e:bd:10, ethertype IPv4 (0x0800), length 244: 192.168.88.2.53 > 192.168.88.141.10221: 23958 2/2/4 CNAME star-mini.c10r.facebook.com., A 31.13.79.220 (202)
15:05:19.829850 00:50:56:e9:db:34 > 00:0c:29:3e:bd:10, ethertype IPv4 (0x0800), length 256: 192.168.88.2.53 > 192.168.88.141.31266: 14994 2/2/4 CNAME star-mini.c10r.facebook.com., AAAA 2a03:2880:f00c:1e:face:b00c:0:25de (214)
15:05:19.972944 00:50:56:e9:db:34 > 00:0c:29:3e:bd:10, ethertype IPv4 (0x0800), length 96: 31.13.79.220.443 > 192.168.88.141.47940: Flags [P.], seq 3437:3479, ack 1794, win 64240, length 42
15:05:19.972982 00:0c:29:3e:bd:10 > 00:50:56:e9:db:34, ethertype IPv4 (0x0800), length 54: 192.168.88.141.47940 > 31.13.79.220.443: Flags [.], ack 3479, win 64860, length 0
15:05:20.402332 00:50:56:e9:db:34 > 00:0c:29:3e:bd:10, ethertype IPv4 (0x0800), length 351: 31.13.79.220.443 > 192.168.88.141.47940: Flags [P.], seq 3479:3776, ack 1794, win 64240, length 297
15:05:20.402357 00:0c:29:3e:bd:10 > 00:50:56:e9:db:34, ethertype IPv4 (0x0800), length 54: 192.168.88.141.47940 > 31.13.79.220.443: Flags [.], ack 3776, win 64860, length 0
15:05:20.410323 00:50:56:e9:db:34 > 00:0c:29:3e:bd:10, ethertype IPv4 (0x0800), length 1464: 31.13.79.220.443 > 192.168.88.141.47940: Flags [P.], seq 3776:5186, ack 1794, win 64240, length 1410
15:05:20.410350 00:0c:29:3e:bd:10 > 00:50:56:e9:db:34, ethertype IPv4 (0x0800), length 54: 192.168.88.141.47940 > 31.13.79.220.443: Flags [.], ack 5186, win 64860, length 0
15:05:20.415448 00:50:56:e9:db:34 > 00:0c:29:3e:bd:10, ethertype IPv4 (0x0800), length 1232: 31.13.79.220.443 > 192.168.88.141.47940: Flags [P.], seq 5186:6364, ack 1794, win 64240, length 1178
15:05:20.415469 00:0c:29:3e:bd:10 > 00:50:56:e9:db:34, ethertype IPv4 (0x0800), length 54: 192.168.88.141.47940 > 31.13.79.220.443: Flags [.], ack 6364, win 64860, length 0
15:05:20.418302 00:50:56:e9:db:34 > 00:0c:29:3e:bd:10, ethertype IPv4 (0x0800), length 437: 31.13.79.220.443 > 192.168.88.141.47940: Flags [P.], seq 6364:6747, ack 1794, win 64240, length 383
15:05:20.418396 00:0c:29:3e:bd:10 > 00:50:56:e9:db:34, ethertype IPv4 (0x0800), length 54: 192.168.88.141.47940 > 31.13.79.220.443: Flags [.], ack 6747, win 64860, length 0
15:05:20.421460 00:50:56:e9:db:34 > 00:0c:29:3e:bd:10, ethertype IPv4 (0x0800), length 102: 31.13.79.220.443 > 192.168.88.141.47940: Flags [P.], seq 6747:6795, ack 1794, win 64240, length 48
15:05:20.421572 00:0c:29:3e:bd:10 > 00:50:56:e9:db:34, ethertype IPv4 (0x0800), length 54: 192.168.88.141.47940 > 31.13.79.220.443: Flags [.], ack 6795, win 64860, length 0
15:05:20.436716 00:0c:29:3e:bd:10 > 00:50:56:e9:db:34, ethertype IPv4 (0x0800), length 245: 192.168.88.141.44658 > 157.240.189.81.443: Flags [P.], seq 282:473, ack 3815, win 65535, length 191
15:05:20.437352 00:50:56:e9:db:34 > 00:0c:29:3e:bd:10, ethertype IPv4 (0x0800), length 60: 157.240.189.81.443 > 192.168.88.141.44658: Flags [.], ack 473, win 64240, length 0
15:05:20.445278 00:0c:29:3e:bd:10 > 00:50:56:e9:db:34, ethertype IPv4 (0x0800), length 246: 192.168.88.141.44658 > 157.240.189.81.443: Flags [P.], seq 473:665, ack 3815, win 65535, length 192
15:05:20.445867 00:50:56:e9:db:34 > 00:0c:29:3e:bd:10, ethertype IPv4 (0x0800), length 60: 157.240.189.81.443 > 192.168.88.141.44658: Flags [.], ack 665, win 64240, length 0
15:05:20.563362 00:50:56:e9:db:34 > 00:0c:29:3e:bd:10, ethertype IPv4 (0x0800), length 96: 157.240.189.81.443 > 192.168.88.141.44658: Flags [P.], seq 3815:3857, ack 665, win 64240, length 42
15:05:20.563386 00:0c:29:3e:bd:10 > 00:50:56:e9:db:34, ethertype IPv4 (0x0800), length 54: 192.168.88.141.44658 > 157.240.189.81.443: Flags [.], ack 3857, win 65535, length 0
15:05:20.565297 00:50:56:e9:db:34 > 00:0c:29:3e:bd:10, ethertype IPv4 (0x0800), length 1464: 157.240.189.81.443 > 192.168.88.141.44658: Flags [P.], seq 3857:5267, ack 665, win 64240, length 1410
15:05:20.565311 00:0c:29:3e:bd:10 > 00:50:56:e9:db:34, ethertype IPv4 (0x0800), length 54: 192.168.88.141.44658 > 157.240.189.81.443: Flags [.], ack 5267, win 65535, length 0
15:05:20.575671 00:50:56:e9:db:34 > 00:0c:29:3e:bd:10, ethertype IPv4 (0x0800), length 1464: 157.240.189.81.443 > 192.168.88.141.44658: Flags [P.], seq 5267:6677, ack 665, win 64240, length 1410
15:05:20.575697 00:0c:29:3e:bd:10 > 00:50:56:e9:db:34, ethertype IPv4 (0x0800), length 54: 192.168.88.141.44658 > 157.240.189.81.443: Flags [.], ack 6677, win 65535, length 0
15:05:20.586436 00:50:56:e9:db:34 > 00:0c:29:3e:bd:10, ethertype IPv4 (0x0800), length 1464: 157.240.189.81.443 > 192.168.88.141.44658: Flags [P.], seq 6677:8087, ack 665, win 64240, length 1410
15:05:20.586540 00:0c:29:3e:bd:10 > 00:50:56:e9:db:34, ethertype IPv4 (0x0800), length 54: 192.168.88.141.44658 > 157.240.189.81.443: Flags [.], ack 8087, win 65535, length 0
15:05:20.586797 00:50:56:e9:db:34 > 00:0c:29:3e:bd:10, ethertype IPv4 (0x0800), length 462: 157.240.189.81.443 > 192.168.88.141.44658: Flags [P.], seq 8087:8495, ack 665, win 64240, length 408
15:05:20.586983 00:0c:29:3e:bd:10 > 00:50:56:e9:db:34, ethertype IPv4 (0x0800), length 54: 192.168.88.141.44658 > 157.240.189.81.443: Flags [.], ack 8495, win 65535, length 0
15:05:20.705593 00:50:56:e9:db:34 > 00:0c:29:3e:bd:10, ethertype IPv4 (0x0800), length 96: 157.240.189.81.443 > 192.168.88.141.44658: Flags [P.], seq 8495:8537, ack 665, win 64240, length 42
15:05:20.705617 00:0c:29:3e:bd:10 > 00:50:56:e9:db:34, ethertype IPv4 (0x0800), length 54: 192.168.88.141.44658 > 157.240.189.81.443: Flags [.], ack 8537, win 65535, length 0
15:05:20.746553 00:50:56:e9:db:34 > 00:0c:29:3e:bd:10, ethertype IPv4 (0x0800), length 1464: 157.240.189.81.443 > 192.168.88.141.44658: Flags [P.], seq 8537:9947, ack 665, win 64240, length 1410
15:05:20.746577 00:0c:29:3e:bd:10 > 00:50:56:e9:db:34, ethertype IPv4 (0x0800), length 54: 192.168.88.141.44658 > 157.240.189.81.443: Flags [.], ack 9947, win 65535, length 0
15:05:20.759856 00:50:56:e9:db:34 > 00:0c:29:3e:bd:10, ethertype IPv4 (0x0800), length 1464: 157.240.189.81.443 > 192.168.88.141.44658: Flags [P.], seq 9947:11357, ack 665, win 64240, length 1410
15:05:20.759885 00:0c:29:3e:bd:10 > 00:50:56:e9:db:34, ethertype IPv4 (0x0800), length 54: 192.168.88.141.44658 > 157.240.189.81.443: Flags [.], ack 11357, win 65535, length 0
15:05:20.765477 00:50:56:e9:db:34 > 00:0c:29:3e:bd:10, ethertype IPv4 (0x0800), length 1464: 157.240.189.81.443 > 192.168.88.141.44658: Flags [P.], seq 11357:12767, ack 665, win 64240, length 1410
15:05:20.765499 00:0c:29:3e:bd:10 > 00:50:56:e9:db:34, ethertype IPv4 (0x0800), length 54: 192.168.88.141.44658 > 157.240.189.81.443: Flags [.], ack 12767, win 65535, length 0
15:05:20.767415 00:50:56:e9:db:34 > 00:0c:29:3e:bd:10, ethertype IPv4 (0x0800), length 1464: 157.240.189.81.443 > 192.168.88.141.44658: Flags [P.], seq 12767:14177, ack 665, win 64240, length 1410
15:05:20.767428 00:0c:29:3e:bd:10 > 00:50:56:e9:db:34, ethertype IPv4 (0x0800), length 54: 192.168.88.141.44658 > 157.240.189.81.443: Flags [.], ack 14177, win 65535, length 0
15:05:20.769777 00:50:56:e9:db:34 > 00:0c:29:3e:bd:10, ethertype IPv4 (0x0800), length 1464: 157.240.189.81.443 > 192.168.88.141.44658: Flags [P.], seq 14177:15587, ack 665, win 64240, length 1410
15:05:20.769792 00:0c:29:3e:bd:10 > 00:50:56:e9:db:34, ethertype IPv4 (0x0800), length 54: 192.168.88.141.44658 > 157.240.189.81.443: Flags [.], ack 15587, win 65535, length 0
15:05:20.772979 00:50:56:e9:db:34 > 00:0c:29:3e:bd:10, ethertype IPv4 (0x0800), length 1464: 157.240.189.81.443 > 192.168.88.141.44658: Flags [P.], seq 15587:16997, ack 665, win 64240, length 1410
15:05:20.772990 00:0c:29:3e:bd:10 > 00:50:56:e9:db:34, ethertype IPv4 (0x0800), length 54: 192.168.88.141.44658 > 157.240.189.81.443: Flags [.], ack 16997, win 65535, length 0
15:05:20.773273 00:50:56:e9:db:34 > 00:0c:29:3e:bd:10, ethertype IPv4 (0x0800), length 1152: 157.240.189.81.443 > 192.168.88.141.44658: Flags [P.], seq 16997:18095, ack 665, win 64240, length 1098
15:05:20.773285 00:0c:29:3e:bd:10 > 00:50:56:e9:db:34, ethertype IPv4 (0x0800), length 54: 192.168.88.141.44658 > 157.240.189.81.443: Flags [.], ack 18095, win 65535, length 0
