12:08:49.936968 00:50:56:c0:00:08 > ff:ff:ff:ff:ff:ff, ethertype IPv4 (0x0800), length 92: 192.168.88.1.137 > 192.168.88.255.137: NBT UDP PACKET(137): QUERY; REQUEST; BROADCAST
12:08:50.348994 00:50:56:c0:00:08 > 01:00:5e:00:00:fc, ethertype IPv4 (0x0800), length 66: 192.168.88.1.52189 > 224.0.0.252.5355: UDP, length 24
12:08:50.689027 00:50:56:c0:00:08 > ff:ff:ff:ff:ff:ff, ethertype IPv4 (0x0800), length 92: 192.168.88.1.137 > 192.168.88.255.137: NBT UDP PACKET(137): QUERY; REQUEST; BROADCAST
12:08:51.441006 00:50:56:c0:00:08 > ff:ff:ff:ff:ff:ff, ethertype IPv4 (0x0800), length 92: 192.168.88.1.137 > 192.168.88.255.137: NBT UDP PACKET(137): QUERY; REQUEST; BROADCAST
12:08:56.683537 00:50:56:c0:00:08 > 01:00:5e:00:00:16, ethertype IPv4 (0x0800), length 60: 192.168.88.1 > 224.0.0.22: igmp v3 report, 1 group record(s)
12:08:56.702709 00:50:56:c0:00:08 > 01:00:5e:00:00:16, ethertype IPv4 (0x0800), length 60: 192.168.88.1 > 224.0.0.22: igmp v3 report, 1 group record(s)
12:08:56.705423 00:50:56:c0:00:08 > 01:00:5e:00:00:16, ethertype IPv4 (0x0800), length 60: 192.168.88.1 > 224.0.0.22: igmp v3 report, 1 group record(s)
12:08:56.705745 00:50:56:c0:00:08 > 01:00:5e:00:00:16, ethertype IPv4 (0x0800), length 60: 192.168.88.1 > 224.0.0.22: igmp v3 report, 1 group record(s)
12:08:57.122899 00:50:56:c0:00:08 > 01:00:5e:00:00:fc, ethertype IPv4 (0x0800), length 70: 192.168.88.1.54706 > 224.0.0.252.5355: UDP, length 28
12:08:57.163856 00:50:56:c0:00:08 > 01:00:5e:00:00:16, ethertype IPv4 (0x0800), length 60: 192.168.88.1 > 224.0.0.22: igmp v3 report, 1 group record(s)
12:08:59.602183 00:0c:29:3e:bd:10 > 00:50:56:e9:db:34, ethertype IPv4 (0x0800), length 100: 192.168.88.137.40343 > 31.13.79.220.443: Flags [P.], seq 3325089983:3325090029, ack 1158852746, win 65535, length 46
12:08:59.602358 00:50:56:e9:db:34 > 00:0c:29:3e:bd:10, ethertype IPv4 (0x0800), length 60: 31.13.79.220.443 > 192.168.88.137.40343: Flags [.], ack 46, win 64240, length 0
12:08:59.682110 00:50:56:e9:db:34 > 00:0c:29:3e:bd:10, ethertype IPv4 (0x0800), length 100: 31.13.79.220.443 > 192.168.88.137.40343: Flags [P.], seq 1:47, ack 46, win 64240, length 46
12:08:59.682132 00:0c:29:3e:bd:10 > 00:50:56:e9:db:34, ethertype IPv4 (0x0800), length 54: 192.168.88.137.40343 > 31.13.79.220.443: Flags [.], ack 47, win 65535, length 0
12:09:03.227294 00:0c:29:3e:bd:10 > 00:50:56:f0:22:eb, ethertype IPv4 (0x0800), length 342: 192.168.88.137.68 > 192.168.88.254.67: BOOTP/DHCP, Request from 00:0c:29:3e:bd:10, length 300
12:09:03.227739 00:50:56:f0:22:eb > 00:0c:29:3e:bd:10, ethertype IPv4 (0x0800), length 342: 192.168.88.254.67 > 192.168.88.137.68: BOOTP/DHCP, Reply, length 300
12:09:03.603653 00:0c:29:3e:bd:10 > 00:50:56:e9:db:34, ethertype IPv4 (0x0800), length 95: 192.168.88.137.45794 > 216.58.218.142.443: Flags [P.], seq 637924518:637924559, ack 2101361941, win 45760, length 41
12:09:03.604000 00:50:56:e9:db:34 > 00:0c:29:3e:bd:10, ethertype IPv4 (0x0800), length 60: 216.58.218.142.443 > 192.168.88.137.45794: Flags [.], ack 41, win 64240, length 0
12:09:03.883607 00:50:56:e9:db:34 > 00:0c:29:3e:bd:10, ethertype IPv4 (0x0800), length 95: 216.58.218.142.443 > 192.168.88.137.45794: Flags [P.], seq 1:42, ack 41, win 64240, length 41
12:09:03.883631 00:0c:29:3e:bd:10 > 00:50:56:e9:db:34, ethertype IPv4 (0x0800), length 54: 192.168.88.137.45794 > 216.58.218.142.443: Flags [.], ack 42, win 45760, length 0
12:09:04.604812 00:0c:29:3e:bd:10 > 00:50:56:e9:db:34, ethertype IPv4 (0x0800), length 95: 192.168.88.137.47574 > 216.58.196.14.443: Flags [P.], seq 823639571:823639612, ack 1903512383, win 46720, length 41
12:09:04.605455 00:50:56:e9:db:34 > 00:0c:29:3e:bd:10, ethertype IPv4 (0x0800), length 60: 216.58.196.14.443 > 192.168.88.137.47574: Flags [.], ack 41, win 64240, length 0
12:09:04.642182 00:50:56:e9:db:34 > 00:0c:29:3e:bd:10, ethertype IPv4 (0x0800), length 95: 216.58.196.14.443 > 192.168.88.137.47574: Flags [P.], seq 1:42, ack 41, win 64240, length 41
12:09:04.642219 00:0c:29:3e:bd:10 > 00:50:56:e9:db:34, ethertype IPv4 (0x0800), length 54: 192.168.88.137.47574 > 216.58.196.14.443: Flags [.], ack 42, win 46720, length 0
12:09:06.779863 00:50:56:c0:00:08 > 01:00:5e:00:00:16, ethertype IPv4 (0x0800), length 60: 192.168.88.1 > 224.0.0.22: igmp v3 report, 1 group record(s)
12:09:06.785968 00:50:56:c0:00:08 > 01:00:5e:00:00:16, ethertype IPv4 (0x0800), length 60: 192.168.88.1 > 224.0.0.22: igmp v3 report, 1 group record(s)
12:09:07.163914 00:50:56:c0:00:08 > 01:00:5e:00:00:16, ethertype IPv4 (0x0800), length 60: 192.168.88.1 > 224.0.0.22: igmp v3 report, 1 group record(s)
12:09:07.198823 00:50:56:c0:00:08 > 01:00:5e:00:00:fc, ethertype IPv4 (0x0800), length 70: 192.168.88.1.61899 > 224.0.0.252.5355: UDP, length 28
12:09:07.258251 00:50:56:e9:db:34 > 00:0c:29:3e:bd:10, ethertype IPv4 (0x0800), length 513: 31.13.79.246.443 > 192.168.88.137.33267: Flags [P.], seq 1478474512:1478474971, ack 1933669056, win 64240, length 459
12:09:07.258313 00:0c:29:3e:bd:10 > 00:50:56:e9:db:34, ethertype IPv4 (0x0800), length 54: 192.168.88.137.33267 > 31.13.79.246.443: Flags [.], ack 459, win 65378, length 0
12:09:07.275300 00:0c:29:3e:bd:10 > 00:50:56:e9:db:34, ethertype IPv4 (0x0800), length 84: 192.168.88.137.15155 > 192.168.88.2.53: 55456+ A? 5-edge-chat.facebook.com. (42)
12:09:07.275531 00:0c:29:3e:bd:10 > 00:50:56:e9:db:34, ethertype IPv4 (0x0800), length 84: 192.168.88.137.36458 > 192.168.88.2.53: 59120+ AAAA? 5-edge-chat.facebook.com. (42)
12:09:07.278926 00:50:56:e9:db:34 > 00:0c:29:3e:bd:10, ethertype IPv4 (0x0800), length 171: 192.168.88.2.53 > 192.168.88.137.36458: 59120 2/2/0 CNAME star.c10r.facebook.com., AAAA 2a03:2880:f00c:6:face:b00c:0:2 (129)
12:09:07.293289 00:0c:29:3e:bd:10 > 00:50:56:e9:db:34, ethertype IPv4 (0x0800), length 1244: 192.168.88.137.33267 > 31.13.79.246.443: Flags [P.], seq 1:1191, ack 459, win 65378, length 1190
12:09:07.293603 00:50:56:e9:db:34 > 00:0c:29:3e:bd:10, ethertype IPv4 (0x0800), length 60: 31.13.79.246.443 > 192.168.88.137.33267: Flags [.], ack 1191, win 64240, length 0
12:09:07.609986 00:50:56:c0:00:08 > 01:00:5e:00:00:16, ethertype IPv4 (0x0800), length 60: 192.168.88.1 > 224.0.0.22: igmp v3 report, 1 group record(s)
12:09:07.610784 00:50:56:c0:00:08 > 01:00:5e:00:00:16, ethertype IPv4 (0x0800), length 60: 192.168.88.1 > 224.0.0.22: igmp v3 report, 1 group record(s)
12:09:07.664099 00:50:56:c0:00:08 > 01:00:5e:00:00:16, ethertype IPv4 (0x0800), length 60: 192.168.88.1 > 224.0.0.22: igmp v3 report, 1 group record(s)
12:09:07.748535 00:50:56:e9:db:34 > 00:0c:29:3e:bd:10, ethertype IPv4 (0x0800), length 99: 31.13.79.246.443 > 192.168.88.137.33267: Flags [P.], seq 459:504, ack 1191, win 64240, length 45
12:09:07.786014 00:0c:29:3e:bd:10 > 00:50:56:e9:db:34, ethertype IPv4 (0x0800), length 54: 192.168.88.137.33267 > 31.13.79.246.443: Flags [.], ack 504, win 65378, length 0
12:09:08.026993 00:50:56:c0:00:08 > 01:00:5e:00:00:fc, ethertype IPv4 (0x0800), length 70: 192.168.88.1.63055 > 224.0.0.252.5355: UDP, length 28
12:09:09.276932 00:50:56:e9:db:34 > 00:0c:29:3e:bd:10, ethertype IPv4 (0x0800), length 159: 192.168.88.2.53 > 192.168.88.137.15155: 55456 2/2/0 CNAME star.c10r.facebook.com., A 31.13.79.246 (117)
12:09:14.112464 00:0c:29:3e:bd:10 > 00:50:56:e9:db:34, ethertype IPv4 (0x0800), length 1221: 192.168.88.137.33267 > 31.13.79.246.443: Flags [P.], seq 1191:2358, ack 504, win 65378, length 1167
12:09:14.112809 00:50:56:e9:db:34 > 00:0c:29:3e:bd:10, ethertype IPv4 (0x0800), length 60: 31.13.79.246.443 > 192.168.88.137.33267: Flags [.], ack 2358, win 64240, length 0
12:09:14.195226 00:50:56:e9:db:34 > 00:0c:29:3e:bd:10, ethertype IPv4 (0x0800), length 99: 31.13.79.246.443 > 192.168.88.137.33267: Flags [P.], seq 504:549, ack 2358, win 64240, length 45
12:09:14.195250 00:0c:29:3e:bd:10 > 00:50:56:e9:db:34, ethertype IPv4 (0x0800), length 54: 192.168.88.137.33267 > 31.13.79.246.443: Flags [.], ack 549, win 65378, length 0
12:09:14.412062 00:50:56:e9:db:34 > 00:0c:29:3e:bd:10, ethertype IPv4 (0x0800), length 474: 31.13.79.246.443 > 192.168.88.137.33267: Flags [P.], seq 549:969, ack 2358, win 64240, length 420
12:09:14.412089 00:0c:29:3e:bd:10 > 00:50:56:e9:db:34, ethertype IPv4 (0x0800), length 54: 192.168.88.137.33267 > 31.13.79.246.443: Flags [.], ack 969, win 65378, length 0
